"hc_x","hc_y","next_event_type","event_and_next_event_type","event_description","batter_name","pitcher_name","outs","balls","strikes","hit_trajectory","fld_score","bat_score","post_fld_score","post_bat_score","is_hit_into_play","is_hit_into_play_basehit","bat_side","pitch_hand","sport_id","game_pk","at_bat_number","event_inning","top_inning_sw","game_date"
,,,"walk","Jacob Amaya walks.  ","Jacob Amaya","Eddy Demurias",1,3,0,,4,3,4,3,0,0,"R","R",14,"577476.00",69,8,"N","2019-05-14"
"120.48","112.05","single","single","Miguel Vargas singles on a ground ball to center fielder Michael Siani.  ","Miguel Vargas","Ricky Salinas",0,1,1,"ground_ball",1,0,1,0,1,1,"R","R",14,"577476.00",7,1,"N","2019-05-14"
"145.31","159.90","field_out","field_out","Miguel Vargas grounds out, second baseman Jonathan Willems to first baseman Shard Munroe.  ","Miguel Vargas","Eddy Demurias",1,3,1,"ground_ball",4,3,4,3,1,0,"R","R",14,"577476.00",64,7,"N","2019-05-14"
"84.31","109.06","field_out","field_out","Brayan Morales flies out to left fielder Casey Golden.  ","Brayan Morales","Ryan Rolison",0,1,0,"fly_ball",0,0,0,0,1,0,"R","L",13,"576567.00",1,1,"Y","2019-05-14"
,,,"strikeout","Dillon Paulson strikes out swinging.  ","Dillon Paulson","Ricky Salinas",0,1,2,,1,0,1,0,0,0,"L","R",14,"577476.00",8,1,"N","2019-05-14"
"182.26","92.67","sac_fly","sac_fly","Miguel Vargas out on a sacrifice fly to right fielder Bren Spillane.   Romer Cuadrado scores.  ","Miguel Vargas","Ricky Salinas",1,1,1,"fly_ball",2,1,2,2,1,0,"R","R",14,"577476.00",21,2,"N","2019-05-14"
"145.31","159.90","field_out","field_out","Miguel Vargas lines out to second baseman Jonathan Willems.  ","Miguel Vargas","Ricky Salinas",0,0,0,"line_drive",3,2,3,2,1,0,"R","R",14,"577476.00",43,5,"N","2019-05-14"
"103.52","173.84","field_out","field_out","Dillon Paulson grounds out, third baseman Juan Martinez to first baseman Shard Munroe.  ","Dillon Paulson","Ricky Salinas",2,0,1,"ground_ball",2,2,2,2,1,0,"L","R",14,"577476.00",22,2,"N","2019-05-14"
"115.29","149.18","single","single","Brandon Montgomery singles on a ground ball to shortstop Carlos Herrera.  ","Brandon Montgomery","Ryan Rolison",1,1,2,"ground_ball",1,0,1,0,1,1,"R","L",13,"576567.00",33,5,"Y","2019-05-14"
,,,"walk","Dillon Paulson walks.  ","Dillon Paulson","Ricky Salinas",1,3,1,,3,2,3,2,0,0,"L","R",14,"577476.00",44,5,"N","2019-05-14"
"136.63","148.17","single","single","Devin Mann singles on a ground ball to second baseman Taylor Snyder.  ","Devin Mann","Ryan Rolison",0,1,1,"ground_ball",1,0,1,0,1,1,"R","L",13,"576567.00",11,2,"Y","2019-05-14"
,,,"strikeout","Brandon Montgomery strikes out swinging.  ","Brandon Montgomery","Ryan Rolison",1,0,2,,1,0,1,0,0,0,"R","L",13,"576567.00",14,2,"Y","2019-05-14"
,,,"strikeout","Dillon Paulson strikes out swinging, catcher Pabel Manzanero to first baseman Shard Munroe.  ","Dillon Paulson","Eddy Demurias",0,0,2,,4,3,4,3,0,0,"L","R",14,"577476.00",68,8,"N","2019-05-14"
"84.82","1.88","home_run","home_run","Marcus Chiu homers (4) on a fly ball to left center field.   Donovan Casey scores.  ","Marcus Chiu","Salvador Justo",2,1,1,"fly_ball",3,1,3,3,1,1,"R","R",13,"576567.00",62,8,"Y","2019-05-14"
"145.77","99.91","field_out","field_out","Marcus Chiu flies out to center fielder Matt Hearn.  ","Marcus Chiu","Ryan Rolison",2,0,0,"fly_ball",0,0,0,0,1,0,"R","L",13,"576567.00",5,1,"Y","2019-05-14"
,,,"strikeout","Marcus Chiu called out on strikes.  ","Marcus Chiu","Ryan Rolison",0,0,2,,1,0,1,0,0,0,"R","L",13,"576567.00",26,4,"Y","2019-05-14"
,,,"strikeout","Marcus Chiu strikes out swinging.  ","Marcus Chiu","Ryan Rolison",1,2,2,,1,0,1,0,0,0,"R","L",13,"576567.00",42,6,"Y","2019-05-14"
,,,"strikeout","Brayan Morales strikes out swinging.  ","Brayan Morales","Ryan Rolison",2,1,2,,1,0,1,0,0,0,"R","L",13,"576567.00",15,2,"Y","2019-05-14"
"104.63","157.31","field_error","field_error","Brayan Morales reaches on a throwing error by shortstop Carlos Herrera.   Brandon Montgomery to 3rd.    Brayan Morales to 2nd.  ","Brayan Morales","Ryan Rolison",1,0,1,"ground_ball",1,0,1,0,1,0,"R","L",13,"576567.00",34,5,"Y","2019-05-14"
"106.15","59.28","field_out","field_out","Brandon Montgomery flies out to center fielder Matt Hearn.  ","Brandon Montgomery","Salvador Justo",1,1,0,"fly_ball",3,3,3,3,1,0,"R","R",13,"576567.00",70,9,"Y","2019-05-14"
,,,"strikeout","Brayan Morales strikes out swinging.  ","Brayan Morales","Salvador Justo",2,2,2,,3,3,3,3,0,0,"R","R",13,"576567.00",71,9,"Y","2019-05-14"
"226.03","63.85","home_run","home_run","Devin Mann homers (6) on a fly ball to right field.  ","Devin Mann","Ryan Rolison",2,0,0,"fly_ball",1,0,1,1,1,1,"R","L",13,"576567.00",43,6,"Y","2019-05-14"
"79.23","102.96","field_out","field_out","Brandon Montgomery lines out to left fielder Casey Golden.  ","Brandon Montgomery","Nate Harris",1,0,1,"line_drive",3,1,3,1,1,0,"R","R",13,"576567.00",53,7,"Y","2019-05-14"
"105.34","173.23","grounded_into_double_play","grounded_into_double_play","Jacob Amaya grounds into a double play, third baseman Carlos Rivero to second baseman Jonathan Willems to first baseman Shard Munroe.   Dillon Paulson out at 2nd.    Jacob Amaya out at 1st.  ","Jacob Amaya","Matt Pidich",1,2,2,"ground_ball",3,2,3,2,1,0,"R","R",14,"577476.00",45,5,"N","2019-05-14"
"127.14","186.56","field_out","field_out","Hunter Feduccia grounds out, pitcher Jared Solomon to first baseman Dylan Harris.  ","Hunter Feduccia","Jared Solomon",2,2,1,"ground_ball",0,0,0,0,1,0,"L","R",14,"577475.00",23,3,"N","2019-05-13"
"99.55","135.47","field_out","field_out","Brandon Montgomery pops out to shortstop Ryan Vilade.  ","Brandon Montgomery","Moises Ceja",2,1,2,"popup",3,7,3,7,1,0,"R","R",13,"576566.00",63,8,"Y","2019-05-13"
"117.83","158.33","field_out","field_out","Devin Mann pops out to shortstop Ryan Vilade.  ","Devin Mann","Lucas Gilbreath",1,2,0,"popup",0,0,0,0,1,0,"R","L",13,"576566.00",9,2,"Y","2019-05-13"
"125.93","98.12","field_out","field_out","Dillon Paulson flies out to center fielder Mariel Bautista.  ","Dillon Paulson","Andy Cox",2,0,0,"fly_ball",2,3,2,3,1,0,"L","L",14,"577475.00",60,7,"N","2019-05-13"
,,,"strikeout","Dillon Paulson strikes out swinging.  ","Dillon Paulson","Jared Solomon",1,3,2,,2,2,2,2,0,0,"L","R",14,"577475.00",42,5,"N","2019-05-13"
"88.88","126.84","field_out","field_out","Devin Mann flies out to left fielder Ramon Marcelino.  ","Devin Mann","Kenny Koplove",2,3,2,"fly_ball",3,7,3,7,1,0,"R","R",13,"576566.00",57,7,"Y","2019-05-13"
"117.83","155.79","field_out","field_out","Devin Mann pops out to shortstop Ryan Vilade on the infield fly rule.  ","Devin Mann","Lucas Gilbreath",0,0,0,"popup",2,5,2,5,1,0,"R","L",13,"576566.00",43,6,"Y","2019-05-13"
"165.07","99.91","field_out","field_out","Devin Mann flies out to right fielder Casey Golden.  ","Devin Mann","Lucas Gilbreath",1,0,2,"fly_ball",0,2,0,2,1,0,"R","L",13,"576566.00",25,4,"Y","2019-05-13"
"72.02","96.91","field_out","field_out","Jacob Amaya flies out to left fielder Shard Munroe.  ","Jacob Amaya","Jared Solomon",2,3,2,"fly_ball",2,2,2,2,1,0,"R","R",14,"577475.00",43,5,"N","2019-05-13"
"76.87","117.51","field_out","field_out","Hunter Feduccia flies out to left fielder Shard Munroe.  ","Hunter Feduccia","Jared Solomon",1,1,1,"fly_ball",0,0,0,0,1,0,"L","R",14,"577475.00",8,1,"N","2019-05-13"
"90.91","130.90","double","double","Brandon Montgomery doubles (4) on a fly ball to left fielder Ramon Marcelino.  ","Brandon Montgomery","Lucas Gilbreath",0,1,0,"fly_ball",0,4,0,4,1,1,"R","L",13,"576566.00",31,5,"Y","2019-05-13"
"114.28","156.30","field_out","field_out","Brandon Montgomery grounds out, shortstop Ryan Vilade to first baseman Todd Czinege.  ","Brandon Montgomery","Lucas Gilbreath",2,1,2,"ground_ball",0,2,0,2,1,0,"R","L",13,"576566.00",12,2,"Y","2019-05-13"
"197.40","126.59","double","double","Miguel Vargas doubles (8) on a line drive to right fielder Reniel Ozuna.  ","Miguel Vargas","Jared Solomon",0,2,2,"line_drive",0,0,0,0,1,1,"R","R",14,"577475.00",27,4,"N","2019-05-13"
,,,"walk","Hunter Feduccia walks.   Niko Hulsizer to 2nd.  ","Hunter Feduccia","Jared Solomon",0,3,0,,2,2,2,2,0,0,"L","R",14,"577475.00",40,5,"N","2019-05-13"
"209.52","93.88","field_out","field_out","Jacob Amaya flies out to right fielder Reniel Ozuna.  ","Jacob Amaya","Andy Cox",0,2,2,"fly_ball",2,3,2,3,1,0,"R","L",14,"577475.00",64,8,"N","2019-05-13"
"94.47","145.63","single","single","Starling Heredia singles on a line drive to left fielder Ramon Marcelino.   Nick Yarnall scores.  ","Starling Heredia","Lucas Gilbreath",2,0,1,"line_drive",0,1,0,2,1,1,"R","L",13,"576566.00",11,2,"Y","2019-05-13"
"130.77","92.07","sac_fly","sac_fly","Hunter Feduccia out on a sacrifice fly to center fielder Mariel Bautista.   Leonel Valera scores.  ","Hunter Feduccia","Connor Bennett",1,2,2,"fly_ball",2,2,2,3,1,0,"L","R",14,"577475.00",58,7,"N","2019-05-13"
"172.57","120.53","single","single","Miguel Vargas singles on a line drive to right fielder Reniel Ozuna.  ","Miguel Vargas","Jared Solomon",2,0,0,"line_drive",0,0,0,0,1,1,"R","R",14,"577475.00",9,1,"N","2019-05-13"
,,,"strikeout","Miguel Vargas strikes out swinging.  ","Miguel Vargas","Jared Solomon",0,0,2,,2,2,2,2,0,0,"R","R",14,"577475.00",41,5,"N","2019-05-13"
"113.21","187.16","single","single","Jacob Amaya singles on a ground ball to third baseman Juan Martinez.  ","Jacob Amaya","Jared Solomon",0,0,1,"ground_ball",0,0,0,0,1,1,"R","R",14,"577475.00",14,2,"N","2019-05-13"
,,,"strikeout","Starling Heredia strikes out swinging, catcher Austin Bernard to first baseman Todd Czinege.  ","Starling Heredia","Moises Ceja",1,0,2,,3,7,3,7,0,0,"R","R",13,"576566.00",62,8,"Y","2019-05-13"
"109.20","155.79","field_out","field_out","Starling Heredia grounds out, shortstop Ryan Vilade to first baseman Todd Czinege.  ","Starling Heredia","Lucas Gilbreath",2,2,1,"ground_ball",0,4,0,4,1,0,"R","L",13,"576566.00",27,4,"Y","2019-05-13"
"155.00","175.65","field_out","field_out","Dillon Paulson grounds out to first baseman Dylan Harris.   Miguel Vargas to 3rd.  ","Dillon Paulson","Jared Solomon",0,2,2,"ground_ball",0,0,0,0,1,0,"L","R",14,"577475.00",28,4,"N","2019-05-13"
,,,"walk","Brandon Montgomery walks.  ","Brandon Montgomery","Lucas Gilbreath",2,3,1,,2,6,2,6,0,0,"R","L",13,"576566.00",46,6,"Y","2019-05-13"
"103.61","174.58","force_out","force_out","Starling Heredia grounds into a force out, fielded by third baseman Sean Bouchard.   Donovan Casey scores.    Carlos Rincon out at 3rd.    Nick Yarnall to 2nd.    Starling Heredia to 1st.  ","Starling Heredia","Lucas Gilbreath",1,2,2,"ground_ball",2,5,2,6,1,0,"R","L",13,"576566.00",45,6,"Y","2019-05-13"
"151.97","162.93","field_out","field_out","Dillon Paulson grounds out, second baseman Jonathan Willems to first baseman Dylan Harris.  ","Dillon Paulson","Jared Solomon",2,0,1,"ground_ball",0,0,0,0,1,0,"L","R",14,"577475.00",10,1,"N","2019-05-13"
"92.62","43.00","double","double","Jacob Amaya doubles (10) on a fly ball to center fielder Mariel Bautista.   Miguel Vargas scores.  ","Jacob Amaya","Jared Solomon",1,1,2,"fly_ball",0,0,0,1,1,1,"R","R",14,"577475.00",29,4,"N","2019-05-13"
"156.82","103.57","single","single","Miguel Vargas singles on a line drive to center fielder Mariel Bautista.   Miguel Vargas to 2nd.  Miguel Vargas advances to 2nd, on a fielding error by center fielder Mariel Bautista.  ","Miguel Vargas","Connor Bennett",2,1,0,"line_drive",2,3,2,3,1,1,"R","R",14,"577475.00",59,7,"N","2019-05-13"
"84.81","96.35","field_out","field_out","Devin Mann lines out sharply to left fielder Mark Karaviotis.  ","Devin Mann","Cole Stapler",2,1,1,"line_drive",4,0,4,0,1,0,"R","R",13,"576703.00",36,4,"N","2019-05-12"
"59.39","75.69","double","double","Brayan Morales doubles (2) on a fly ball to left fielder Mark Karaviotis.   Drew Avans scores.  ","Brayan Morales","Kyler Stout",1,3,2,"fly_ball",6,2,6,3,1,1,"R","R",13,"576703.00",64,7,"N","2019-05-12"
,,,"strikeout","Marcus Chiu called out on strikes.  ","Marcus Chiu","Cole Stapler",0,0,2,,0,0,0,0,0,0,"R","R",13,"576703.00",15,2,"N","2019-05-12"
,,,"strikeout","Devin Mann strikes out swinging.  ","Devin Mann","Luis Castillo",2,1,2,,6,7,6,7,0,0,"R","R",13,"576703.00",69,7,"N","2019-05-12"
,,,"strikeout","Marcus Chiu called out on strikes.  ","Marcus Chiu","Kyler Stout",1,0,2,,6,1,6,1,0,0,"R","R",13,"576703.00",55,6,"N","2019-05-12"
,,,"strikeout","Brayan Morales strikes out swinging.  ","Brayan Morales","West Tunnell",0,3,2,,11,7,11,7,0,0,"R","R",13,"576703.00",88,9,"N","2019-05-12"
,,,"strikeout","Devin Mann strikes out swinging.  ","Devin Mann","Cole Stapler",1,1,2,,0,0,0,0,0,0,"R","R",13,"576703.00",16,2,"N","2019-05-12"
"188.07","103.50","sac_fly","sac_fly","Brayan Morales out on a sacrifice fly to right fielder Jorge Perez.   Jordan Procyshen scores.  ","Brayan Morales","Cole Stapler",1,2,1,"fly_ball",4,0,4,1,1,0,"R","R",13,"576703.00",43,5,"N","2019-05-12"
,,,"strikeout","Brayan Morales strikes out swinging.  ","Brayan Morales","Cole Stapler",1,1,2,,0,0,0,0,0,0,"R","R",13,"576703.00",23,3,"N","2019-05-12"
,,,"strikeout","Marcus Chiu called out on strikes.  ","Marcus Chiu","Cole Stapler",1,1,2,,4,0,4,0,0,0,"R","R",13,"576703.00",35,4,"N","2019-05-12"
,,,"strikeout","Devin Mann called out on strikes.  ","Devin Mann","Kyler Stout",2,0,2,,6,1,6,1,0,0,"R","R",13,"576703.00",56,6,"N","2019-05-12"
,,,"walk","Brayan Morales walks.  ","Brayan Morales","Cole Stapler",0,3,1,,0,0,0,0,0,0,"R","R",13,"576703.00",7,1,"N","2019-05-12"
"199.20","106.67","sac_fly","sac_fly","Marcus Chiu out on a sacrifice fly to right fielder Jorge Perez.   Donovan Casey scores.  ","Marcus Chiu","Luis Castillo",1,2,2,"fly_ball",6,6,6,7,1,0,"R","R",13,"576703.00",68,7,"N","2019-05-12"
"136.44","78.08","field_out","field_out","Brayan Morales flies out to center fielder Anfernee Grier.  ","Brayan Morales","Bryan Valdez",2,0,1,"fly_ball",3,5,3,5,1,0,"R","L",13,"576702.00",62,7,"N","2019-05-11"
"139.62","89.99","single","single","Brayan Morales singles on a line drive to center fielder Anfernee Grier.  ","Brayan Morales","Shumpei Yoshikawa",0,1,2,"line_drive",3,0,3,0,1,1,"R","R",13,"576702.00",9,1,"N","2019-05-11"
"193.64","113.82","field_out","field_out","Devin Mann flies out to right fielder Yoel Yanqui.  ","Devin Mann","Bryan Valdez",2,1,0,"fly_ball",3,4,3,4,1,0,"R","L",13,"576702.00",54,6,"N","2019-05-11"
"86.40","41.53","home_run","home_run","Starling Heredia homers (4) on a fly ball to left center field.  ","Starling Heredia","Bryan Valdez",1,0,1,"fly_ball",3,4,3,5,1,1,"R","L",13,"576702.00",60,7,"N","2019-05-11"
"184.10","106.67","field_out","field_out","Brayan Morales flies out to right fielder Yoel Yanqui.  ","Brayan Morales","Shumpei Yoshikawa",0,0,2,"fly_ball",3,2,3,2,1,0,"R","R",13,"576702.00",27,3,"N","2019-05-11"
"111.02","177.37","field_out","field_out","Brandon Montgomery grounds out, third baseman Alex King to first baseman Mark Karaviotis.  ","Brandon Montgomery","Bryan Valdez",1,1,1,"ground_ball",3,5,3,5,1,0,"R","L",13,"576702.00",61,7,"N","2019-05-11"
"202.37","120.18","field_out","field_out","Brandon Montgomery flies out to right fielder Yoel Yanqui.  ","Brandon Montgomery","Shumpei Yoshikawa",2,0,0,"fly_ball",3,2,3,2,1,0,"R","R",13,"576702.00",21,2,"N","2019-05-11"
"211.91","115.41","field_out","field_out","Brandon Montgomery flies out to right fielder Yoel Yanqui.  ","Brandon Montgomery","Bryan Valdez",0,1,2,"fly_ball",3,4,3,4,1,0,"R","L",13,"576702.00",45,5,"N","2019-05-11"
"166.63","164.66","field_out","field_out","Brayan Morales pops out to second baseman Jancarlos Cintron.  ","Brayan Morales","Bryan Valdez",1,0,1,"popup",3,4,3,4,1,0,"R","L",13,"576702.00",46,5,"N","2019-05-11"
,,,"strikeout","Starling Heredia strikes out swinging.  ","Starling Heredia","Shumpei Yoshikawa",1,0,2,,3,2,3,2,0,0,"R","R",13,"576702.00",20,2,"N","2019-05-11"
,,,"strikeout","Devin Mann strikes out swinging.  ","Devin Mann","Shumpei Yoshikawa",0,2,2,,3,3,3,3,0,0,"R","R",13,"576702.00",36,4,"N","2019-05-11"
"131.67","183.73","grounded_into_double_play","grounded_into_double_play","Starling Heredia grounds into a double play, pitcher Shumpei Yoshikawa to second baseman Jancarlos Cintron to first baseman Mark Karaviotis.   Jordan Procyshen out at 2nd.    Starling Heredia out at 1st.  ","Starling Heredia","Shumpei Yoshikawa",1,0,0,"ground_ball",3,4,3,4,1,0,"R","R",13,"576702.00",38,4,"N","2019-05-11"
"139.62","157.51","field_out","field_out","Devin Mann grounds out, pitcher Shumpei Yoshikawa to second baseman Jancarlos Cintron to first baseman Mark Karaviotis.  ","Devin Mann","Shumpei Yoshikawa",0,2,1,"ground_ball",3,2,3,2,1,0,"R","R",13,"576702.00",18,2,"N","2019-05-11"
"124.53","190.08","field_out","field_out","Brayan Morales grounds out softly, pitcher Josh Green to first baseman Yoel Yanqui.  ","Brayan Morales","Josh Green",1,2,0,"ground_ball",4,1,4,1,1,0,"R","R",13,"576701.00",24,3,"N","2019-05-10"
,,,"strikeout","Brayan Morales strikes out swinging.  ","Brayan Morales","Josh Green",0,2,2,,7,1,7,1,0,0,"R","R",13,"576701.00",49,6,"N","2019-05-10"
,,,"strikeout","Devin Mann strikes out swinging.  ","Devin Mann","West Tunnell",2,0,2,,7,2,2,7,0,0,"R","R",13,"576701.00",75,9,"N","2019-05-10"
"111.82","178.17","field_out","field_out","Devin Mann grounds out, third baseman Jose Caballero to first baseman Yoel Yanqui.  ","Devin Mann","Cole Bartlett",1,1,2,"ground_ball",7,2,7,2,1,0,"R","R",13,"576701.00",59,7,"N","2019-05-10"
"112.61","156.72","field_out","field_out","Marcus Chiu grounds out, shortstop Jancarlos Cintron to first baseman Yoel Yanqui.  ","Marcus Chiu","Cole Bartlett",2,0,0,"ground_ball",7,2,7,2,1,0,"R","R",13,"576701.00",68,8,"N","2019-05-10"
,,,"hit_by_pitch","Marcus Chiu hit by pitch.  ","Marcus Chiu","Josh Green",0,0,1,,7,1,7,1,0,0,"R","R",13,"576701.00",34,4,"N","2019-05-10"
"85.60","113.03","single","single","Marcus Chiu singles on a ground ball to left fielder Mark Karaviotis.   Jeter Downs scores.  ","Marcus Chiu","Josh Green",0,3,0,"ground_ball",4,0,4,1,1,1,"R","R",13,"576701.00",10,1,"N","2019-05-10"
"124.53","89.20","single","single","Marcus Chiu singles on a line drive to center fielder Anfernee Grier.   Jeter Downs to 2nd.  ","Marcus Chiu","Josh Green",1,2,0,"line_drive",7,1,7,1,1,1,"R","R",13,"576701.00",51,6,"N","2019-05-10"
"104.67","179.75","field_out","field_out","Starling Heredia grounds out, third baseman Jose Caballero to first baseman Yoel Yanqui.  ","Starling Heredia","Josh Green",2,1,1,"ground_ball",7,1,7,1,1,0,"R","R",13,"576701.00",45,5,"N","2019-05-10"
"84.81","97.93","field_out","field_out","Starling Heredia flies out to left fielder Mark Karaviotis.  ","Starling Heredia","Cole Bartlett",2,2,2,"fly_ball",7,2,7,2,1,0,"R","R",13,"576701.00",61,7,"N","2019-05-10"
"101.49","174.19","field_out","field_out","Devin Mann grounds out, third baseman Jose Caballero to first baseman Yoel Yanqui.  ","Devin Mann","Josh Green",1,3,2,"ground_ball",4,1,4,1,1,0,"R","R",13,"576701.00",17,2,"N","2019-05-10"
"130.09","184.52","field_out","field_out","Starling Heredia grounds out softly, pitcher Josh Green to first baseman Yoel Yanqui.  ","Starling Heredia","Josh Green",0,1,2,"ground_ball",4,1,4,1,1,0,"R","R",13,"576701.00",23,3,"N","2019-05-10"
"136.44","83.64","field_out","field_out","Brayan Morales flies out to center fielder Anfernee Grier.  ","Brayan Morales","Cole Bartlett",0,0,0,"fly_ball",7,2,7,2,1,0,"R","R",13,"576701.00",66,8,"N","2019-05-10"
"131.67","73.31","field_out","field_out","Devin Mann flies out to center fielder Anfernee Grier.  ","Devin Mann","Josh Green",0,3,2,"fly_ball",7,1,7,1,1,0,"R","R",13,"576701.00",43,5,"N","2019-05-10"
"84.01","97.14","single","single","Devin Mann singles on a ground ball to left fielder Kevin Williams.  ","Devin Mann","Kyle Bradish",2,2,2,"ground_ball",0,0,0,0,1,1,"R","R",13,"576700.00",13,2,"N","2019-05-09"
"107.05","177.37","force_out","force_out","Marcus Chiu grounds into a force out, third baseman Zane Gurwitz to second baseman Michael Stefanic.   Carlos Rincon to 3rd.    Jeter Downs out at 2nd.    Marcus Chiu to 1st.  ","Marcus Chiu","Jorge Tavarez",1,1,1,"ground_ball",0,0,0,0,1,0,"R","R",13,"576700.00",46,6,"N","2019-05-09"
"99.90","169.43","field_out","field_out","Brandon Montgomery grounds out, third baseman Zane Gurwitz to first baseman Jordan Zimmerman.  ","Brandon Montgomery","Isaac Mattson",2,0,1,"ground_ball",0,0,0,0,1,0,"R","R",13,"576700.00",69,9,"N","2019-05-09"
,,,"strikeout","Brandon Montgomery strikes out swinging.  ","Brandon Montgomery","Jorge Tavarez",2,3,2,,0,0,0,0,0,0,"R","R",13,"576700.00",47,6,"N","2019-05-09"
"171.39","122.56","single","single","Devin Mann singles on a soft line drive to right fielder Ryan Vega.  ","Devin Mann","Kyle Bradish",2,2,1,"line_drive",0,0,0,0,1,1,"R","R",13,"576700.00",30,4,"N","2019-05-09"
"151.53","157.51","single","single","Brandon Montgomery singles on a ground ball to second baseman Michael Stefanic.  ","Brandon Montgomery","Kyle Bradish",0,0,0,"ground_ball",0,0,0,0,1,1,"R","R",13,"576700.00",35,5,"N","2019-05-09"
,,,"strikeout","Marcus Chiu strikes out swinging.  ","Marcus Chiu","Kyle Bradish",2,1,2,,0,0,0,0,0,0,"R","R",13,"576700.00",14,2,"N","2019-05-09"
"94.34","89.20","field_out","field_out","Marcus Chiu flies out to left fielder Kevin Williams.  ","Marcus Chiu","Kyle Bradish",2,2,2,"fly_ball",0,0,0,0,1,0,"R","R",13,"576700.00",31,4,"N","2019-05-09"
"98.31","110.64","single","single","Brayan Morales singles on a line drive to left fielder Kevin Williams.  ","Brayan Morales","Jorge Tavarez",1,0,0,"line_drive",0,0,0,0,1,1,"R","R",13,"576700.00",54,7,"N","2019-05-09"
"111.82","153.54","field_out","field_out","Marcus Chiu grounds out, shortstop Leonardo Rivas to first baseman Jordan Zimmerman.  ","Marcus Chiu","Isaac Mattson",1,1,2,"ground_ball",0,0,0,0,1,0,"R","R",13,"576700.00",68,9,"N","2019-05-09"
"80.84","66.95","field_out","field_out","Devin Mann flies out to left fielder Kevin Williams.  ","Devin Mann","Isaac Mattson",0,0,2,"fly_ball",0,0,0,0,1,0,"R","R",13,"576700.00",67,9,"N","2019-05-09"
,,,"strikeout","Devin Mann strikes out on a foul tip.  ","Devin Mann","Jorge Tavarez",0,2,2,,0,0,0,0,0,0,"R","R",13,"576700.00",45,6,"N","2019-05-09"
"94.34","124.15","field_out","field_out","Brayan Morales flies out to left fielder Kevin Williams.  ","Brayan Morales","Isaac Mattson",1,0,2,"fly_ball",1,0,1,0,1,0,"R","R",13,"576700.00",74,10,"N","2019-05-09"
"188.07","137.65","double","double","Brayan Morales doubles (1) on a soft line drive to first baseman Jordan Zimmerman.   Brandon Montgomery to 3rd.  ","Brayan Morales","Kyle Bradish",1,1,1,"line_drive",0,0,0,0,1,1,"R","R",13,"576700.00",37,5,"N","2019-05-09"
"84.01","103.50","single","single","Brandon Montgomery singles on a ground ball to left fielder Kevin Williams.  ","Brandon Montgomery","Kyle Bradish",0,1,1,"ground_ball",0,0,0,0,1,1,"R","R",13,"576700.00",19,3,"N","2019-05-09"
"127.70","189.29","sac_bunt","sac_bunt","Brayan Morales out on a sacrifice bunt, pitcher Kyle Bradish to first baseman Jordan Zimmerman.   Brandon Montgomery to 3rd.    Drew Avans to 2nd.  ","Brayan Morales","Kyle Bradish",0,0,0,"ground_ball",0,0,0,0,1,0,"R","R",13,"576700.00",21,3,"N","2019-05-09"
,,,"strikeout","Brayan Morales strikes out swinging.  ","Brayan Morales","Kyle Bradish",0,3,2,,0,0,0,0,0,0,"R","R",13,"576700.00",5,1,"N","2019-05-09"
,,,"strikeout","Devin Mann strikes out swinging.  ","Devin Mann","Jake Lee",1,0,2,,1,2,1,2,0,0,"R","R",13,"576699.00",27,3,"N","2019-05-08"
"123.73","83.64","field_out","field_out","Brandon Montgomery flies out to center fielder Leonardo Rivas.  ","Brandon Montgomery","Jake Lee",1,2,1,"fly_ball",0,1,0,2,1,0,"R","R",13,"576699.00",17,2,"N","2019-05-08"
"146.83","158.28","field_out","field_out","Hunter Feduccia lines out to second baseman Eddie Hernandez.  ","Hunter Feduccia","Ryan Miller",2,0,1,"line_drive",3,10,3,10,1,0,"L","R",14,"577541.00",65,7,"Y","2019-05-08"
"188.91","75.65","double","double","Hunter Feduccia doubles (7) on a fly ball to right fielder Eduardo Diaz.   Dan Robinson scores.    Luke Heyer to 3rd.  ","Hunter Feduccia","Erin Baldwin",1,2,1,"fly_ball",3,5,3,6,1,1,"L","R",14,"577541.00",52,6,"Y","2019-05-08"
"137.24","89.99","single","single","Devin Mann singles on a soft line drive to center fielder Leonardo Rivas.  ","Devin Mann","Jake Lee",1,0,0,"line_drive",0,1,0,1,1,1,"R","R",13,"576699.00",8,1,"N","2019-05-08"
"88.78","97.93","field_out","field_out","Devin Mann flies out to left fielder Ryan Vega.  ","Devin Mann","Jake Lee",1,0,0,"fly_ball",3,5,3,5,1,0,"R","R",13,"576699.00",47,5,"N","2019-05-08"
,,,"strikeout","Starling Heredia called out on strikes.  ","Starling Heredia","Jake Lee",2,1,2,,1,5,1,5,0,0,"R","R",13,"576699.00",31,3,"N","2019-05-08"
,,,"strikeout","Starling Heredia called out on strikes.  ","Starling Heredia","Jake Lee",0,1,2,,0,1,0,1,0,0,"R","R",13,"576699.00",15,2,"N","2019-05-08"
"126.11","182.93","field_out","field_out","Starling Heredia grounds out, pitcher Jake Lee to first baseman Jordan Zimmerman.  ","Starling Heredia","Jake Lee",2,0,2,"ground_ball",4,5,4,5,1,0,"R","R",13,"576699.00",56,6,"N","2019-05-08"
"188.87","106.67","field_out","field_out","Devin Mann flies out to right fielder Torii Hunter.  ","Devin Mann","Nate Bertness",2,0,0,"fly_ball",4,5,4,5,1,0,"R","L",13,"576699.00",64,7,"N","2019-05-08"
"136.19","148.65","field_out","field_out","Hunter Feduccia grounds out, shortstop Geraldo Perdomo to first baseman Zachery Almond.   Dan Robinson to 3rd.  ","Hunter Feduccia","Ryan Weiss",1,0,1,"ground_ball",0,2,0,2,1,0,"L","R",14,"577541.00",13,2,"Y","2019-05-08"
"105.26","163.35","field_out","field_out","Hunter Feduccia grounds out, third baseman Buddy Kennedy to first baseman Zachery Almond.  ","Hunter Feduccia","Ryan Weiss",0,1,1,"ground_ball",0,0,0,0,1,0,"L","R",14,"577541.00",1,1,"Y","2019-05-08"
"154.44","156.26","field_out","field_out","Hunter Feduccia lines out to third baseman Buddy Kennedy.  ","Hunter Feduccia","Ryan Weiss",1,3,2,"line_drive",3,4,3,4,1,0,"L","R",14,"577541.00",33,4,"Y","2019-05-08"
