"hc_x","hc_y","next_event_type","event_and_next_event_type","event_description","batter_name","pitcher_name","outs","balls","strikes","hit_trajectory","fld_score","bat_score","post_fld_score","post_bat_score","is_hit_into_play","is_hit_into_play_basehit","bat_side","pitch_hand","sport_id","game_pk","at_bat_number","event_inning","top_inning_sw","game_date"
"182.85","62.33","double","double","Deacon Liput doubles (7) on a line drive to right fielder Aldemar Burgos.  ","Deacon Liput","Elliot Ashbeck",0,0,0,"line_drive",1,2,1,2,1,1,"L","R",13,"576516.00",20,3,"Y","2019-06-24"
"116.31","187.79","field_out","field_out","Deacon Liput pops out to third baseman Eguy Rosario.  ","Deacon Liput","Elliot Ashbeck",1,1,2,"popup",0,0,0,0,1,0,"L","R",13,"576516.00",3,1,"Y","2019-06-24"
"148.31","160.87","field_out","field_out","Starling Heredia grounds out, second baseman Esteury Ruiz to first baseman Connor Panas.  ","Starling Heredia","Elliot Ashbeck",2,0,1,"ground_ball",1,3,1,3,1,0,"R","R",13,"576516.00",24,3,"Y","2019-06-24"
,,,"walk","Jeren Kendall walks.  ","Jeren Kendall","Will Headean",2,3,2,,4,8,4,8,0,0,"L","L",13,"576516.00",77,9,"Y","2019-06-24"
,,,"strikeout","Starling Heredia called out on strikes.  ","Starling Heredia","Will Headean",0,2,2,,4,8,4,8,0,0,"R","L",13,"576516.00",74,9,"Y","2019-06-24"
"167.61","105.50","single","single","Marcus Chiu singles on a line drive to right fielder Aldemar Burgos.  ","Marcus Chiu","Elliot Ashbeck",1,1,1,"line_drive",4,3,4,3,1,1,"R","R",13,"576516.00",32,4,"Y","2019-06-24"
"112.75","78.58","field_out","field_out","Jeren Kendall lines out to center fielder Jeisson Rosario.  ","Jeren Kendall","Elliot Ashbeck",0,1,1,"line_drive",0,0,0,0,1,0,"L","R",13,"576516.00",1,1,"Y","2019-06-24"
"59.93","33.37","home_run","home_run","Devin Mann homers (14) on a fly ball to left center field.  ","Devin Mann","Ryan Rolison",2,1,1,"fly_ball",0,0,0,1,1,1,"R","L",13,"576585.00",17,3,"Y","2019-06-23"
"135.10","92.29","field_out","field_out","Devin Mann flies out to center fielder Matt Hearn.  ","Devin Mann","Ryan Rolison",0,1,1,"fly_ball",5,2,5,2,1,0,"R","L",13,"576585.00",39,5,"Y","2019-06-23"
"167.54","173.18","field_out","field_out","Jacob Amaya pops out to first baseman Lee Solomon in foul territory.  ","Jacob Amaya","Cody Tyler",2,1,2,"popup",0,0,0,0,1,0,"R","L",14,"577495.00",41,6,"N","2019-06-23"
"144.75","157.31","field_out","field_out","Deacon Liput grounds out, second baseman Matt McLaughlin to first baseman Todd Czinege.  ","Deacon Liput","Ryan Rolison",2,0,1,"ground_ball",5,2,5,2,1,0,"L","L",13,"576585.00",49,6,"Y","2019-06-23"
"189.96","112.61","sac_fly","sac_fly","Brayan Morales out on a sacrifice fly to right fielder Ramon Marcelino.   Deacon Liput scores.  ","Brayan Morales","Salvador Justo",1,2,1,"fly_ball",8,6,8,7,1,0,"R","R",13,"576585.00",71,8,"Y","2019-06-23"
"97.46","116.29","single","single","Miguel Vargas singles on a fly ball to left fielder Dwanya Williams-Sutton.   Leonel Valera to 3rd.    Miguel Vargas to 2nd.  ","Miguel Vargas","Carlos Belen",0,0,0,"fly_ball",0,1,0,1,1,1,"R","R",14,"577495.00",56,8,"N","2019-06-23"
,,,"strikeout","Marcus Chiu strikes out swinging.  ","Marcus Chiu","Salvador Justo",2,3,2,,8,8,8,8,0,0,"R","R",13,"576585.00",73,8,"Y","2019-06-23"
"80.50","107.81","sac_fly","sac_fly","Jacob Amaya out on a sacrifice fly to left fielder Dwanya Williams-Sutton.   Leonel Valera scores.  ","Jacob Amaya","Carlos Belen",0,1,1,"fly_ball",0,1,0,2,1,0,"R","R",14,"577495.00",58,8,"N","2019-06-23"
,,,"strikeout","Brayan Morales strikes out on a foul tip.  ","Brayan Morales","Ryan Rolison",2,0,2,,0,2,0,2,0,0,"R","L",13,"576585.00",29,4,"Y","2019-06-23"
,,,"walk","Jacob Amaya walks.  ","Jacob Amaya","Efrain Contreras",1,3,1,,0,0,0,0,0,0,"R","R",14,"577495.00",26,4,"N","2019-06-23"
"99.32","121.54","single","single","Eric Peterson singles on a line drive to left fielder Taylor Kohlwey.  ","Eric Peterson","Michel Baez",0,2,2,"line_drive",3,3,3,3,1,1,"R","R",12,"584368.00",69,8,"N","2019-06-23"
"190.47","41.50","home_run","home_run","Devin Mann homers (15) on a fly ball to right center field.  ","Devin Mann","Salvador Justo",2,1,1,"fly_ball",8,7,8,8,1,1,"R","R",13,"576585.00",72,8,"Y","2019-06-23"
"130.31","77.06","field_out","field_out","Eric Peterson flies out to center fielder Buddy Reed.  ","Eric Peterson","Adrian Morejon",2,2,1,"fly_ball",0,2,0,2,1,0,"R","L",12,"584368.00",11,1,"N","2019-06-23"
"101.07","170.52","field_out","field_out","Brayan Morales lines out to third baseman Sean Bouchard.  ","Brayan Morales","Ryan Rolison",1,0,2,"line_drive",0,0,0,0,1,0,"R","L",13,"576585.00",16,3,"Y","2019-06-23"
,,,"walk","Miguel Vargas walks.  ","Miguel Vargas","Efrain Contreras",0,3,2,,0,0,0,0,0,0,"R","R",14,"577495.00",4,1,"N","2019-06-23"
"195.55","45.56","home_run","home_run","Marcus Chiu homers (8) on a fly ball to right center field.  ","Marcus Chiu","Ryan Rolison",2,3,1,"fly_ball",0,1,0,2,1,1,"R","L",13,"576585.00",18,3,"Y","2019-06-23"
"104.73","173.23","field_out","field_out","Miguel Vargas grounds out, third baseman Tucupita Marcano to first baseman Lee Solomon.  ","Miguel Vargas","Efrain Contreras",2,0,1,"ground_ball",0,0,0,0,1,0,"R","R",14,"577495.00",20,3,"N","2019-06-23"
,,,"walk","Jacob Amaya walks.  ","Jacob Amaya","Efrain Contreras",2,3,2,,0,0,0,0,0,0,"R","R",14,"577495.00",6,1,"N","2019-06-23"
"101.07","170.52","field_out","field_out","Marcus Chiu grounds out, third baseman Sean Bouchard to first baseman Todd Czinege.  ","Marcus Chiu","Ryan Rolison",1,0,0,"ground_ball",5,2,5,2,1,0,"R","L",13,"576585.00",40,5,"Y","2019-06-23"
"112.75","156.80","force_out","force_out","Brayan Morales grounds into a force out, shortstop Ryan Vilade to second baseman Matt McLaughlin.   Nick Yarnall out at 2nd.    Brayan Morales to 1st.  ","Brayan Morales","Nate Harris",0,2,2,"ground_ball",5,2,5,2,1,0,"R","R",13,"576585.00",55,7,"Y","2019-06-23"
,,,"walk","Devin Mann walks.  ","Devin Mann","Nate Harris",1,3,2,,5,2,5,2,0,0,"R","R",13,"576585.00",56,7,"Y","2019-06-23"
"163.55","103.98","field_out","field_out","Marcus Chiu flies out to center fielder Matt Hearn.   Devin Mann to 3rd.  ","Marcus Chiu","Ryan Rolison",0,1,2,"fly_ball",0,0,0,0,1,0,"R","L",13,"576585.00",2,1,"Y","2019-06-23"
"102.59","138.01","single","single","Deacon Liput singles on a line drive to left fielder Casey Golden.   Niko Hulsizer to 3rd.  ","Deacon Liput","Ryan Rolison",2,1,0,"line_drive",0,2,0,2,1,1,"L","L",13,"576585.00",27,4,"Y","2019-06-23"
"199.61","68.42","double","double","Deacon Liput doubles (6) on a fly ball to right fielder Ramon Marcelino.  ","Deacon Liput","Salvador Justo",0,0,1,"fly_ball",8,6,8,6,1,1,"L","R",13,"576585.00",69,8,"Y","2019-06-23"
,,,"strikeout","Deacon Liput strikes out swinging.  ","Deacon Liput","Ryan Rolison",2,1,2,,0,0,0,0,0,0,"L","L",13,"576585.00",10,2,"Y","2019-06-23"
"151.75","121.54","single","single","Eric Peterson singles on a line drive to right fielder Edward Olivares.  ","Eric Peterson","Ronald Bolanos",2,0,0,"line_drive",2,2,2,2,1,1,"R","R",12,"584368.00",52,6,"N","2019-06-23"
"177.77","141.06","double","double","Devin Mann doubles (16) on a soft fly ball to right fielder Ramon Marcelino.  ","Devin Mann","Ryan Rolison",0,1,0,"fly_ball",0,0,0,0,1,1,"R","L",13,"576585.00",1,1,"Y","2019-06-23"
,,,"strikeout","Marcus Chiu called out on strikes.  ","Marcus Chiu","Nate Harris",1,2,2,,5,2,5,2,0,0,"R","R",13,"576585.00",57,7,"Y","2019-06-23"
"179.23","142.95","single","single","Miguel Vargas singles on a line drive to right fielder Agustin Ruiz.   Leonel Valera to 2nd.  ","Miguel Vargas","Cody Tyler",0,1,2,"line_drive",0,0,0,0,1,1,"R","L",14,"577495.00",39,6,"N","2019-06-23"
,,,"strikeout","Eric Peterson called out on strikes.  ","Eric Peterson","Ronald Bolanos",2,2,2,,2,2,2,2,0,0,"R","R",12,"584368.00",31,3,"N","2019-06-23"
"24.88","50.14","home_run","home_run","Marcus Chiu homers (7) on a fly ball to left field.   Donovan Casey scores.  ","Marcus Chiu","Garrett Schilling",1,0,0,"fly_ball",2,2,2,4,1,1,"R","R",13,"576584.00",46,6,"Y","2019-06-22"
,,,"strikeout","Starling Heredia strikes out swinging.  ","Starling Heredia","Garrett Schilling",1,3,2,,0,2,0,2,0,0,"R","R",13,"576584.00",25,3,"Y","2019-06-22"
,,,"strikeout","Marcus Chiu strikes out swinging.  ","Marcus Chiu","Garrett Schilling",2,1,2,,0,2,0,2,0,0,"R","R",13,"576584.00",26,3,"Y","2019-06-22"
"111.74","158.84","field_out","field_out","Marcus Chiu grounds out, shortstop Taylor Snyder to first baseman Sean Bouchard.  ","Marcus Chiu","Garrett Schilling",0,1,0,"ground_ball",0,0,0,0,1,0,"R","R",13,"576584.00",13,2,"Y","2019-06-22"
,,,"strikeout","Starling Heredia strikes out swinging.  ","Starling Heredia","Garrett Schilling",2,3,2,,0,0,0,0,0,0,"R","R",13,"576584.00",6,1,"Y","2019-06-22"
,,,"strikeout","Starling Heredia called out on strikes.  ","Starling Heredia","Nick Kennedy",0,1,2,,2,8,2,8,0,0,"R","L",13,"576584.00",59,7,"Y","2019-06-22"
,,,"walk","Deacon Liput walks.  ","Deacon Liput","Garrett Schilling",2,3,2,,2,4,2,4,0,0,"L","R",13,"576584.00",49,6,"Y","2019-06-22"
"156.95","174.58","field_out","field_out","Deacon Liput grounds out to first baseman Sean Bouchard.  ","Deacon Liput","Garrett Schilling",2,0,0,"ground_ball",0,2,0,2,1,0,"L","R",13,"576584.00",32,4,"Y","2019-06-22"
"175.74","129.37","single","single","Deacon Liput singles on a line drive to right fielder Luke Morgan.  ","Deacon Liput","Garrett Schilling",0,1,1,"line_drive",0,0,0,0,1,1,"L","R",13,"576584.00",20,3,"Y","2019-06-22"
"112.75","45.56","field_out","field_out","Deacon Liput flies out to center fielder Matt Hearn.  ","Deacon Liput","Garrett Schilling",0,0,0,"fly_ball",0,0,0,0,1,0,"L","R",13,"576584.00",1,1,"Y","2019-06-22"
,,,"strikeout","Jeren Kendall strikes out swinging.  ","Jeren Kendall","Austin Moore",2,3,2,,2,10,2,10,0,0,"L","R",13,"576584.00",66,7,"Y","2019-06-22"
"122.90","112.05","single","single","Miguel Vargas singles on a ground ball to center fielder Grant Little.   Matt Cogen to 2nd.  ","Miguel Vargas","Angel Acevedo",1,2,0,"ground_ball",0,0,0,0,1,1,"R","R",14,"577494.00",56,8,"N","2019-06-22"
,,,"hit_by_pitch","Devin Mann hit by pitch.  ","Devin Mann","Garrett Schilling",0,2,0,,0,0,0,1,0,0,"R","R",13,"576584.00",22,3,"Y","2019-06-22"
"139.67","156.80","force_out","force_out","Jeren Kendall grounds into a force out, second baseman Matt McLaughlin to shortstop Taylor Snyder.   Devin Mann out at 2nd.  ","Jeren Kendall","Nick Kennedy",2,0,0,"ground_ball",2,7,2,7,1,0,"L","L",13,"576584.00",52,6,"Y","2019-06-22"
"148.31","169.50","field_out","field_out","Jeren Kendall grounds out, first baseman Sean Bouchard to pitcher Garrett Schilling.  ","Jeren Kendall","Garrett Schilling",2,0,2,"ground_ball",1,2,1,2,1,0,"L","R",13,"576584.00",39,5,"Y","2019-06-22"
"90.19","144.16","single","single","Jacob Amaya singles on a ground ball to third baseman Kelvin Melean.   Hunter Feduccia to 2nd.  ","Jacob Amaya","Sam Keating",1,3,1,"ground_ball",0,0,0,0,1,1,"R","R",14,"577494.00",8,1,"N","2019-06-22"
,,,"walk","Jeren Kendall walks.  ","Jeren Kendall","Garrett Schilling",2,3,2,,0,0,0,0,0,0,"L","R",13,"576584.00",4,1,"Y","2019-06-22"
"104.12","165.96","grounded_into_double_play","grounded_into_double_play","Jacob Amaya grounds into a double play, shortstop Xavier Edwards to second baseman Tucupita Marcano to first baseman Luis Roman.   Miguel Vargas out at 2nd.    Jacob Amaya out at 1st.  ","Jacob Amaya","Sam Keating",1,1,2,"ground_ball",0,0,0,0,1,0,"R","R",14,"577494.00",23,3,"N","2019-06-22"
"101.70","169.60","grounded_into_double_play","grounded_into_double_play","Jacob Amaya grounds into a double play, third baseman Kelvin Melean to second baseman Tucupita Marcano to first baseman Luis Roman.   Hunter Feduccia out at 2nd.    Jacob Amaya out at 1st.  ","Jacob Amaya","Sam Keating",0,1,0,"ground_ball",0,0,0,0,1,0,"R","R",14,"577494.00",43,6,"N","2019-06-22"
"90.91","123.79","single","single","Devin Mann singles on a line drive to left fielder Ramon Marcelino.   Brayan Morales scores.    Deacon Liput to 3rd.    Jeter Downs to 2nd.  ","Devin Mann","Austin Moore",2,1,1,"line_drive",2,9,2,10,1,1,"R","R",13,"576584.00",65,7,"Y","2019-06-22"
,,,"strikeout","Brayan Morales called out on strikes.  ","Brayan Morales","Garrett Schilling",1,1,2,,0,2,0,2,0,0,"R","R",13,"576584.00",31,4,"Y","2019-06-22"
"107.67","158.84","field_out","field_out","Brayan Morales lines out to shortstop Taylor Snyder.  ","Brayan Morales","Austin Moore",1,0,1,"line_drive",5,10,5,10,1,0,"R","R",13,"576584.00",81,9,"Y","2019-06-22"
"154.41","170.01","single","single","Deacon Liput singles on a ground ball to first baseman Sean Bouchard.   Brayan Morales to 3rd.  ","Deacon Liput","Nick Kennedy",2,2,2,"ground_ball",2,9,2,9,1,1,"L","L",13,"576584.00",63,7,"Y","2019-06-22"
,,,"strikeout","Brayan Morales called out on strikes.  ","Brayan Morales","Garrett Schilling",2,3,2,,0,0,0,0,0,0,"R","R",13,"576584.00",15,2,"Y","2019-06-22"
"89.39","131.41","single","single","Devin Mann singles on a line drive to left fielder Ramon Marcelino.   Jeter Downs scores.  ","Devin Mann","Nick Kennedy",2,2,0,"line_drive",2,6,2,7,1,1,"R","L",13,"576584.00",51,6,"Y","2019-06-22"
"82.28","49.12","field_out","field_out","Devin Mann flies out to left fielder Ramon Marcelino.  ","Devin Mann","Garrett Schilling",1,3,0,"fly_ball",1,2,1,2,1,0,"R","R",13,"576584.00",38,5,"Y","2019-06-22"
"136.83","85.40","field_out","field_out","Miguel Vargas flies out to center fielder Grant Little.  ","Miguel Vargas","Sam Keating",2,0,0,"fly_ball",0,0,0,0,1,0,"R","R",14,"577494.00",37,5,"N","2019-06-22"
,,,"strikeout","Jacob Amaya called out on strikes.  ","Jacob Amaya","Jose Quezada",1,2,2,,0,0,0,0,0,0,"R","R",14,"577494.00",58,8,"N","2019-06-22"
"103.52","82.98","field_out","field_out","Miguel Vargas flies out to center fielder Grant Little.  ","Miguel Vargas","Sam Keating",0,0,2,"fly_ball",0,0,0,0,1,0,"R","R",14,"577494.00",6,1,"N","2019-06-22"
,,,"walk","Brayan Morales walks.  ","Brayan Morales","Garrett Schilling",2,3,2,,2,4,2,4,0,0,"R","R",13,"576584.00",48,6,"Y","2019-06-22"
"141.07","111.45","single","single","Miguel Vargas singles on a line drive to center fielder Grant Little.  ","Miguel Vargas","Sam Keating",0,0,2,"line_drive",0,0,0,0,1,1,"R","R",14,"577494.00",21,3,"N","2019-06-22"
"101.58","173.57","field_out","field_out","Devin Mann grounds out, third baseman Ryan Vilade to first baseman Sean Bouchard.  ","Devin Mann","Garrett Schilling",1,1,1,"ground_ball",0,0,0,0,1,0,"R","R",13,"576584.00",3,1,"Y","2019-06-22"
,,,"intent_walk","Henry Henry intentionally walks Miguel Vargas.  ","Miguel Vargas","Henry Henry",2,3,0,,1,1,1,1,0,0,"R","R",14,"577494.00",74,10,"N","2019-06-22"
,,,"strikeout","Deacon Liput strikes out swinging.  ","Deacon Liput","Austin Moore",2,2,2,,5,10,5,10,0,0,"L","R",13,"576584.00",82,9,"Y","2019-06-22"
,,,"strikeout","Eric Peterson strikes out swinging.  ","Eric Peterson","Nick Margevicius",1,1,2,,0,0,0,0,0,0,"R","L",12,"584367.00",17,3,"N","2019-06-22"
"163.67","110.42","single","single","Eric Peterson singles on a line drive to right fielder Edward Olivares.  ","Eric Peterson","Nick Margevicius",0,0,1,"line_drive",0,0,0,0,1,1,"R","L",12,"584367.00",36,6,"N","2019-06-22"
"104.88","129.49","field_out","field_out","Eric Peterson pops out to shortstop Owen Miller.  ","Eric Peterson","Jean Cosme",0,0,1,"popup",1,1,1,1,1,0,"R","R",12,"584367.00",69,10,"N","2019-06-22"
"73.23","110.84","field_out","field_out","Dillon Paulson flies out to left fielder Michael Curry.  ","Dillon Paulson","Sam Keating",0,2,2,"fly_ball",0,0,0,0,1,0,"L","R",14,"577494.00",28,4,"N","2019-06-22"
,,,"strikeout","Eric Peterson strikes out on a foul tip.  ","Eric Peterson","Lake Bachar",1,0,2,,0,1,0,1,0,0,"R","R",12,"584367.00",48,7,"N","2019-06-22"
"152.58","172.62","force_out","force_out","Dillon Paulson grounds into a force out, first baseman Lee Solomon to shortstop Xavier Edwards.   Chris Roller to 3rd.    Jacob Amaya out at 2nd.    Dillon Paulson to 1st.  ","Dillon Paulson","Henry Henry",0,1,2,"ground_ball",1,1,1,1,1,0,"L","R",14,"577494.00",80,11,"N","2019-06-22"
"84.74","124.17","field_out","field_out","Hunter Feduccia flies out to left fielder Michael Curry.  ","Hunter Feduccia","Sam Keating",0,0,0,"fly_ball",0,0,0,0,1,0,"L","R",14,"577494.00",22,3,"N","2019-06-22"
,,,"walk","Hunter Feduccia walks.  ","Hunter Feduccia","Sam Keating",0,3,1,,0,0,0,0,0,0,"L","R",14,"577494.00",42,6,"N","2019-06-22"
,,,"intent_walk","Henry Henry intentionally walks Jacob Amaya.  ","Jacob Amaya","Henry Henry",0,3,0,,1,1,1,1,0,0,"R","R",14,"577494.00",79,11,"N","2019-06-22"
"98.07","130.83","single","single","Hunter Feduccia singles on a line drive to left fielder Michael Curry.  ","Hunter Feduccia","Sam Keating",1,2,1,"line_drive",0,0,0,0,1,1,"L","R",14,"577494.00",7,1,"N","2019-06-22"
,,,"strikeout","Dillon Paulson strikes out swinging.  ","Dillon Paulson","Jose Quezada",2,2,2,,0,0,0,1,0,0,"L","R",14,"577494.00",59,8,"N","2019-06-22"
,,,"walk","Hunter Feduccia walks.   Matt Cogen to 3rd.    Miguel Vargas to 2nd.  ","Hunter Feduccia","Jose Quezada",1,3,1,,0,0,0,0,0,0,"L","R",14,"577494.00",57,8,"N","2019-06-22"
"147.73","162.33","force_out","force_out","Dillon Paulson grounds into a force out, second baseman Tucupita Marcano to shortstop Xavier Edwards.   Hunter Feduccia to 3rd.    Jacob Amaya out at 2nd.    Dillon Paulson to 1st.  ","Dillon Paulson","Sam Keating",1,2,1,"ground_ball",0,0,0,0,1,0,"L","R",14,"577494.00",9,1,"N","2019-06-22"
"90.91","124.80","single","single","Brayan Morales singles on a ground ball to left fielder Ramon Marcelino.  ","Brayan Morales","Nick Kennedy",2,0,0,"ground_ball",2,9,2,9,1,1,"R","L",13,"576584.00",62,7,"Y","2019-06-22"
"66.02","107.53","sac_fly","sac_fly","Jeren Kendall out on a sacrifice fly to left fielder Ramon Marcelino.   Jeter Downs scores.  ","Jeren Kendall","Garrett Schilling",0,2,1,"fly_ball",0,1,0,2,1,0,"L","R",13,"576584.00",23,3,"Y","2019-06-22"
,,,"strikeout","Marcus Chiu strikes out swinging.  ","Marcus Chiu","Austin Moore",2,3,2,,5,10,5,10,0,0,"R","R",13,"576584.00",75,8,"Y","2019-06-22"
"132.06","130.39","field_out","field_out","Starling Heredia pops out to second baseman Matt McLaughlin.  ","Starling Heredia","Garrett Schilling",0,0,1,"popup",2,2,2,2,1,0,"R","R",13,"576584.00",45,6,"Y","2019-06-22"
"147.73","165.96","field_out","field_out","Hunter Feduccia grounds out, second baseman Tucupita Marcano to first baseman Lee Solomon.  ","Hunter Feduccia","Henry Henry",2,0,0,"ground_ball",1,1,1,1,1,0,"L","R",14,"577494.00",75,10,"N","2019-06-22"
"124.94","39.98","field_out","field_out","Starling Heredia flies out to center fielder Matt Hearn.  ","Starling Heredia","Austin Moore",1,1,1,"fly_ball",5,10,5,10,1,0,"R","R",13,"576584.00",74,8,"Y","2019-06-22"
,,,"strikeout","Dillon Paulson strikes out swinging.  ","Dillon Paulson","Sam Keating",2,2,2,,0,0,0,0,0,0,"L","R",14,"577494.00",44,6,"N","2019-06-22"
"74.66","120.23","field_out","field_out","Marcus Chiu flies out to left fielder Ramon Marcelino.  ","Marcus Chiu","Nick Kennedy",1,3,1,"fly_ball",2,8,2,8,1,0,"R","L",13,"576584.00",60,7,"Y","2019-06-22"
"203.46","87.22","field_out","field_out","Jacob Amaya flies out to right fielder Agustin Ruiz.  ","Jacob Amaya","Ryan Weathers",2,0,0,"fly_ball",0,0,0,0,1,0,"R","L",14,"577493.00",6,1,"N","2019-06-21"
,,,"walk","Dillon Paulson walks.  ","Dillon Paulson","Ryan Weathers",0,3,2,,2,0,2,0,0,0,"L","L",14,"577493.00",13,2,"N","2019-06-21"
"122.87","183.53","single","single","Deacon Liput singles on a ground ball to pitcher Tommy Doyle.  ","Deacon Liput","Tommy Doyle",0,0,0,"ground_ball",13,6,13,6,1,1,"L","R",13,"576583.00",83,9,"Y","2019-06-21"
"136.83","94.49","field_out","field_out","Jacob Amaya flies out to center fielder Grant Little.  ","Jacob Amaya","Ryan Weathers",2,1,1,"fly_ball",3,1,3,1,1,0,"R","L",14,"577493.00",27,3,"N","2019-06-21"
,,,"strikeout","Dillon Paulson strikes out swinging.  ","Dillon Paulson","Adrian Martinez",2,1,2,,3,6,3,6,0,0,"L","R",14,"577493.00",55,6,"N","2019-06-21"
"128.32","71.47","field_out","field_out","Jeren Kendall flies out to center fielder Matt Hearn.  ","Jeren Kendall","Will Gaddis",1,0,0,"fly_ball",9,4,9,4,1,0,"L","R",13,"576583.00",47,5,"Y","2019-06-21"
"204.04","84.19","sac_fly","sac_fly","Jeren Kendall out on a sacrifice fly to right fielder Casey Golden.   Devin Mann scores.    Deacon Liput to 3rd.  ","Jeren Kendall","Will Gaddis",0,0,0,"fly_ball",5,0,5,1,1,0,"L","R",13,"576583.00",27,3,"Y","2019-06-21"
,,,"hit_by_pitch","Devin Mann hit by pitch.  ","Devin Mann","Will Gaddis",0,0,0,,5,0,5,0,0,0,"R","R",13,"576583.00",25,3,"Y","2019-06-21"
"106.52","159.30","force_out","force_out","Brayan Morales grounds into a force out, shortstop Ryan Vilade to second baseman Taylor Snyder.   Nick Yarnall out at 2nd.  ","Brayan Morales","Will Gaddis",2,0,0,"ground_ball",9,4,9,4,1,0,"R","R",13,"576583.00",56,6,"Y","2019-06-21"
,,,"strikeout","Jeren Kendall called out on strikes.  ","Jeren Kendall","Will Gaddis",1,0,2,,0,0,0,0,0,0,"L","R",13,"576583.00",4,1,"Y","2019-06-21"
,,,"strikeout","Deacon Liput strikes out swinging.  ","Deacon Liput","Will Gaddis",0,0,2,,0,0,0,0,0,0,"L","R",13,"576583.00",3,1,"Y","2019-06-21"
"178.60","87.22","single","single","Deacon Liput singles on a line drive to center fielder Matt Hearn.   Devin Mann to 3rd.    Deacon Liput to 2nd.  ","Deacon Liput","Will Gaddis",0,0,0,"line_drive",5,0,5,0,1,1,"L","R",13,"576583.00",26,3,"Y","2019-06-21"
"158.00","93.88","double","double","Devin Mann doubles (15) on a line drive to center fielder Matt Hearn.  ","Devin Mann","Robert Tyler",1,0,0,"line_drive",9,4,9,4,1,1,"R","R",13,"576583.00",61,7,"Y","2019-06-21"
"173.78","181.10","field_out","field_out","Miguel Vargas pops out to first baseman Lee Solomon in foul territory.  ","Miguel Vargas","Adrian Martinez",1,3,2,"popup",3,6,3,6,1,0,"R","R",14,"577493.00",52,6,"N","2019-06-21"
"75.63","119.93","field_out","field_out","Brayan Morales flies out to left fielder Sean Bouchard.  ","Brayan Morales","Will Gaddis",1,0,0,"fly_ball",0,0,0,0,1,0,"R","R",13,"576583.00",12,2,"Y","2019-06-21"
"140.44","93.28","field_out","field_out","Brayan Morales flies out to center fielder Matt Hearn.  ","Brayan Morales","Will Gaddis",1,0,0,"fly_ball",5,3,5,3,1,0,"R","R",13,"576583.00",35,4,"Y","2019-06-21"
,,,"walk","Miguel Vargas walks.  ","Miguel Vargas","Austin Smith",2,3,2,,3,6,3,6,0,0,"R","R",14,"577493.00",67,8,"N","2019-06-21"
"33.23","62.39","home_run","home_run","Devin Mann homers (13) on a fly ball to left field.  ","Devin Mann","Will Gaddis",0,3,1,"fly_ball",9,3,9,4,1,1,"R","R",13,"576583.00",45,5,"Y","2019-06-21"
"145.92","111.45","single","single","Dillon Paulson singles on a ground ball to right fielder Agustin Ruiz.  ","Dillon Paulson","Adrian Martinez",2,3,2,"ground_ball",3,5,3,5,1,1,"L","R",14,"577493.00",43,5,"N","2019-06-21"
"170.75","147.19","single","single","Dillon Paulson singles on a line drive to right fielder Agustin Ruiz.  ","Dillon Paulson","Ryan Weathers",0,0,0,"line_drive",3,1,3,1,1,1,"L","L",14,"577493.00",31,4,"N","2019-06-21"
"112.00","159.90","field_out","field_out","Miguel Vargas grounds out, shortstop Justin Lopez to first baseman Lee Solomon.  ","Miguel Vargas","Adrian Martinez",2,1,1,"ground_ball",3,5,3,5,1,0,"R","R",14,"577493.00",37,4,"N","2019-06-21"
,,,"strikeout","Jacob Amaya strikes out swinging.  ","Jacob Amaya","Adrian Martinez",1,1,2,,3,5,3,5,0,0,"R","R",14,"577493.00",42,5,"N","2019-06-21"
"86.56","126.59","single","single","Miguel Vargas singles on a ground ball to left fielder Michael Curry.  ","Miguel Vargas","Ryan Weathers",2,2,2,"ground_ball",3,1,3,1,1,1,"R","L",14,"577493.00",25,3,"N","2019-06-21"
,,,"strikeout","Deacon Liput strikes out swinging.  ","Deacon Liput","Robert Tyler",1,0,2,,9,4,9,4,0,0,"L","R",13,"576583.00",62,7,"Y","2019-06-21"
"127.75","184.13","single","single","Jacob Amaya singles on a line drive to pitcher Adrian Martinez.   Chris Roller to 3rd.  ","Jacob Amaya","Adrian Martinez",2,0,2,"line_drive",3,6,3,6,1,1,"R","R",14,"577493.00",54,6,"N","2019-06-21"
,,,"strikeout","Jeren Kendall called out on strikes.  ","Jeren Kendall","Robert Tyler",2,0,2,,9,4,9,4,0,0,"L","R",13,"576583.00",63,7,"Y","2019-06-21"
"156.79","85.40","double","double","Devin Mann doubles (14) on a line drive to center fielder Matt Hearn.   Jeter Downs to 3rd.  ","Devin Mann","Will Gaddis",0,0,0,"line_drive",0,0,0,0,1,1,"R","R",13,"576583.00",2,1,"Y","2019-06-21"
"181.63","98.73","field_out","field_out","Jeren Kendall flies out to right fielder Casey Golden.  ","Jeren Kendall","Tommy Doyle",0,0,0,"fly_ball",13,6,13,6,1,0,"L","R",13,"576583.00",84,9,"Y","2019-06-21"
"96.46","88.18","field_out","field_out","Eric Peterson flies out to center fielder Buddy Reed.  ","Eric Peterson","Nick Kuzia",2,1,2,"fly_ball",4,2,4,2,1,0,"R","R",12,"584366.00",59,7,"N","2019-06-21"
,,,"strikeout","Miguel Vargas called out on strikes.  ","Miguel Vargas","Ryan Weathers",0,0,2,,0,0,0,0,0,0,"R","L",14,"577493.00",4,1,"N","2019-06-21"
"146.49","154.45","field_out","field_out","Deacon Liput lines out to second baseman Taylor Snyder.  ","Deacon Liput","Will Gaddis",0,0,0,"line_drive",9,4,9,4,1,0,"L","R",13,"576583.00",46,5,"Y","2019-06-21"
,,,"strikeout","Brayan Morales strikes out swinging.   Nick Yarnall scores.    Brayan Morales to 1st.  Wild pitch by pitcher Hayden Roberts.  Throwing error by catcher Austin Bernard.  ","Brayan Morales","Hayden Roberts",2,0,2,,11,5,11,6,0,0,"R","R",13,"576583.00",75,8,"Y","2019-06-21"
,,,"strikeout","Devin Mann strikes out swinging.  ","Devin Mann","Hayden Roberts",2,0,2,,11,6,11,6,0,0,"R","R",13,"576583.00",77,8,"Y","2019-06-21"
"147.13","159.90","field_out","field_out","Jacob Amaya lines out to second baseman Xavier Edwards.  ","Jacob Amaya","Jose Quezada",1,0,0,"line_drive",0,0,0,0,1,0,"R","R",14,"577492.00",49,7,"N","2019-06-20"
