"hc_x","hc_y","next_event_type","event_and_next_event_type","event_description","batter_name","pitcher_name","outs","balls","strikes","hit_trajectory","fld_score","bat_score","post_fld_score","post_bat_score","is_hit_into_play","is_hit_into_play_basehit","bat_side","pitch_hand","sport_id","game_pk","at_bat_number","event_inning","top_inning_sw","game_date"
"138.03","75.69","field_out","field_out","Marcus Chiu flies out to center fielder Jordyn Adams.  ","Marcus Chiu","Travis Herrin",0,0,0,"fly_ball",5,1,5,1,1,0,"R","R",13,"576754.00",39,5,"N","2019-08-31"
"207.14","139.24","field_out","field_out","Brayan Morales flies out to right fielder Spencer Griffin in foul territory.  ","Brayan Morales","Austin Krzeminski",0,0,0,"fly_ball",5,1,5,1,1,0,"R","R",13,"576754.00",60,8,"N","2019-08-31"
"44.29","95.55","double","double","Brandon Montgomery doubles (5) on a sharp ground ball to left fielder Torii Hunter.  ","Brandon Montgomery","Travis Herrin",1,1,0,"ground_ball",5,1,5,1,1,1,"R","R",13,"576754.00",40,5,"N","2019-08-31"
"144.38","164.66","field_out","field_out","Jeren Kendall pops out to second baseman Leonardo Rivas.  ","Jeren Kendall","Austin Krzeminski",2,0,0,"popup",5,1,5,1,1,0,"L","R",13,"576754.00",62,8,"N","2019-08-31"
"108.64","174.99","field_out","field_out","Jacob Amaya grounds out, third baseman Zane Gurwitz to first baseman Devin Davis.  ","Jacob Amaya","Travis Herrin",1,0,0,"ground_ball",1,0,1,0,1,0,"R","R",13,"576754.00",6,1,"N","2019-08-31"
"133.26","87.61","single","single","Tre Todd singles on a line drive to center fielder Jordyn Adams.  ","Tre Todd","Travis Herrin",0,3,2,"line_drive",1,0,1,0,1,1,"L","R",13,"576754.00",18,3,"N","2019-08-31"
,,,"strikeout","Starling Heredia strikes out swinging.  ","Starling Heredia","Travis Herrin",2,2,2,,5,1,5,1,0,0,"R","R",13,"576754.00",50,6,"N","2019-08-31"
"116.58","155.92","field_out","field_out","Brandon Montgomery grounds out, shortstop Michael Stefanic to first baseman Devin Davis.   Tre Todd scores.  ","Brandon Montgomery","Travis Herrin",0,2,0,"ground_ball",1,0,1,1,1,0,"R","R",13,"576754.00",20,3,"N","2019-08-31"
"189.66","97.93","field_out","field_out","Jacob Amaya flies out to right fielder Spencer Griffin.  ","Jacob Amaya","Travis Herrin",2,0,0,"fly_ball",1,1,1,1,1,0,"R","R",13,"576754.00",22,3,"N","2019-08-31"
"108.64","180.55","force_out","force_out","Starling Heredia grounds into a force out, third baseman Zane Gurwitz to second baseman Leonardo Rivas.   Deacon Liput out at 2nd.    Starling Heredia to 1st.  ","Starling Heredia","Austin Krzeminski",1,2,2,"ground_ball",5,1,5,1,1,0,"R","R",13,"576754.00",69,9,"N","2019-08-31"
,,,"strikeout","Jacob Amaya strikes out swinging.  ","Jacob Amaya","Austin Krzeminski",1,1,2,,5,1,5,1,0,0,"R","R",13,"576754.00",61,8,"N","2019-08-31"
"110.23","171.81","field_out","field_out","Jacob Amaya grounds out, third baseman Zane Gurwitz to first baseman Devin Davis.  ","Jacob Amaya","Travis Herrin",2,1,0,"ground_ball",5,1,5,1,1,0,"R","R",13,"576754.00",42,5,"N","2019-08-31"
"149.15","159.90","field_out","field_out","Jeren Kendall grounds out, second baseman Leonardo Rivas to first baseman Devin Davis.  ","Jeren Kendall","Travis Herrin",0,0,0,"ground_ball",5,1,5,1,1,0,"L","R",13,"576754.00",47,6,"N","2019-08-31"
,,,"strikeout","Jeren Kendall strikes out swinging.  ","Jeren Kendall","Travis Herrin",2,2,2,,1,0,1,0,0,0,"L","R",13,"576754.00",7,1,"N","2019-08-31"
,,,"strikeout","Deacon Liput strikes out swinging.  ","Deacon Liput","Travis Herrin",1,2,2,,5,1,5,1,0,0,"L","R",13,"576754.00",49,6,"N","2019-08-31"
,,,"walk","Deacon Liput walks.  ","Deacon Liput","Austin Krzeminski",1,3,2,,5,1,5,1,0,0,"L","R",13,"576754.00",68,9,"N","2019-08-31"
,,,"strikeout","Deacon Liput called out on strikes.  ","Deacon Liput","Travis Herrin",1,2,2,,1,0,1,0,0,0,"L","R",13,"576754.00",13,2,"N","2019-08-31"
"114.20","174.99","force_out","force_out","Deacon Liput grounds into a force out, third baseman Zane Gurwitz to shortstop Michael Stefanic.   Miguel Vargas out at 2nd.    Deacon Liput to 1st.  ","Deacon Liput","Travis Herrin",1,0,0,"ground_ball",5,1,5,1,1,0,"L","R",13,"576754.00",33,4,"N","2019-08-31"
,,,"strikeout","Tre Todd strikes out swinging, catcher Alexis Olmeda to first baseman Devin Davis.  ","Tre Todd","Travis Herrin",0,2,2,,5,1,5,1,0,0,"L","R",13,"576754.00",54,7,"N","2019-08-31"
,,,"strikeout","Tre Todd strikes out swinging.  ","Tre Todd","Travis Herrin",2,3,2,,5,1,5,1,0,0,"L","R",13,"576754.00",35,4,"N","2019-08-31"
"112.61","171.02","field_out","field_out","Brayan Morales grounds out, third baseman Zane Gurwitz to first baseman Devin Davis.  ","Brayan Morales","Travis Herrin",1,1,2,"ground_ball",5,1,5,1,1,0,"R","R",13,"576754.00",41,5,"N","2019-08-31"
"185.69","123.35","single","single","Starling Heredia singles on a ground ball to right fielder Spencer Griffin.   Deacon Liput to 3rd.  ","Starling Heredia","Travis Herrin",2,1,1,"ground_ball",5,1,5,1,1,1,"R","R",13,"576754.00",34,4,"N","2019-08-31"
"131.67","92.37","single","single","Brayan Morales singles on a line drive to center fielder Jordyn Adams.  Marcus Chiu out at home on the throw, center fielder Jordyn Adams to catcher Alexis Olmeda.   Brayan Morales to 2nd.  ","Brayan Morales","Travis Herrin",1,2,1,"line_drive",1,1,1,1,1,1,"R","R",13,"576754.00",21,3,"N","2019-08-31"
"144.38","157.51","field_out","field_out","Brayan Morales grounds out, second baseman Leonardo Rivas to first baseman Devin Davis.  ","Brayan Morales","Travis Herrin",0,0,1,"ground_ball",1,0,1,0,1,0,"R","R",13,"576754.00",5,1,"N","2019-08-31"
"177.75","120.18","field_out","field_out","Jeren Kendall flies out to right fielder Spencer Griffin.  ","Jeren Kendall","Travis Herrin",0,1,2,"fly_ball",5,1,5,1,1,0,"L","R",13,"576754.00",31,4,"N","2019-08-31"
"85.60","74.10","field_out","field_out","Miguel Vargas flies out to left fielder Torii Hunter.  ","Miguel Vargas","Travis Herrin",0,0,0,"fly_ball",1,0,1,0,1,0,"R","R",13,"576754.00",12,2,"N","2019-08-31"
"73.69","92.37","single","single","Miguel Vargas singles on a ground ball to left fielder Torii Hunter.  ","Miguel Vargas","Travis Herrin",1,1,1,"ground_ball",5,1,5,1,1,1,"R","R",13,"576754.00",32,4,"N","2019-08-31"
"109.43","170.22","field_error","field_error","Miguel Vargas reaches on a fielding error by third baseman Zane Gurwitz.   Miguel Vargas to 2nd.  ","Miguel Vargas","Travis Herrin",1,1,1,"ground_ball",5,1,5,1,1,0,"R","R",13,"576754.00",48,6,"N","2019-08-31"
"111.82","65.37","field_out","field_out","Tre Todd flies out to center fielder Jordyn Adams.  ","Tre Todd","Austin Krzeminski",2,0,0,"fly_ball",5,1,1,5,1,0,"L","R",13,"576754.00",70,9,"N","2019-08-31"
"153.92","172.61","field_out","field_out","Starling Heredia grounds out, first baseman Devin Davis to pitcher Travis Herrin.  ","Starling Heredia","Travis Herrin",2,1,1,"ground_ball",1,0,1,0,1,0,"R","R",13,"576754.00",14,2,"N","2019-08-31"
,,,"strikeout","Miguel Vargas strikes out swinging.  ","Miguel Vargas","Austin Krzeminski",0,2,2,,5,1,5,1,0,0,"R","R",13,"576754.00",67,9,"N","2019-08-31"
,,,"strikeout","Marcus Chiu called out on strikes.  ","Marcus Chiu","Travis Herrin",1,3,2,,5,1,5,1,0,0,"R","R",13,"576754.00",55,7,"N","2019-08-31"
"144.38","156.72","field_out","field_out","Brandon Montgomery lines out softly to second baseman Leonardo Rivas.  ","Brandon Montgomery","Travis Herrin",2,2,2,"line_drive",5,1,5,1,1,0,"R","R",13,"576754.00",56,7,"N","2019-08-31"
"132.47","189.29","sac_bunt","sac_bunt","Marcus Chiu hits a sacrifice bunt.   Throwing error by pitcher Travis Herrin.   Tre Todd to 3rd.    Marcus Chiu to 2nd.  ","Marcus Chiu","Travis Herrin",0,1,0,"ground_ball",1,0,1,0,1,0,"R","R",13,"576754.00",19,3,"N","2019-08-31"
,,,"strikeout","Jeren Kendall strikes out swinging.  ","Jeren Kendall","Connor Higgins",2,0,2,,5,3,3,5,0,0,"L","L",13,"576753.00",77,9,"N","2019-08-30"
"127.70","80.46","field_out","field_out","Garrett Hope flies out to center fielder Jordyn Adams.  ","Garrett Hope","Kyle Bradish",2,2,1,"fly_ball",4,1,4,1,1,0,"R","R",13,"576753.00",36,4,"N","2019-08-30"
"33.17","71.72","home_run","home_run","Starling Heredia homers (10) on a line drive to left field.  ","Starling Heredia","Connor Higgins",2,2,0,"line_drive",5,2,5,3,1,1,"R","L",13,"576753.00",75,9,"N","2019-08-30"
"147.56","160.69","field_out","field_out","Dillon Paulson grounds out, second baseman Michael Stefanic to first baseman Devin Davis.   Starling Heredia scores.    Jeren Kendall to 2nd.  ","Dillon Paulson","Kyle Bradish",1,0,0,"ground_ball",3,0,3,1,1,0,"L","R",13,"576753.00",26,3,"N","2019-08-30"
"154.71","170.22","double_play","double_play","Garrett Hope lines into a double play, first baseman Devin Davis to shortstop Leonardo Rivas.   Miguel Vargas out at 2nd.  ","Garrett Hope","Kyle Bradish",1,1,1,"line_drive",3,0,3,0,1,0,"R","R",13,"576753.00",18,2,"N","2019-08-30"
"91.96","101.11","single","single","Brayan Morales singles on a line drive to left fielder Spencer Griffin.  ","Brayan Morales","Connor Higgins",2,0,2,"line_drive",5,3,5,3,1,1,"R","L",13,"576753.00",76,9,"N","2019-08-30"
"190.46","113.03","single","single","Dillon Paulson singles on a line drive to right fielder Orlando Martinez.  ","Dillon Paulson","Kyle Bradish",2,1,1,"line_drive",0,0,0,0,1,1,"L","R",13,"576753.00",6,1,"N","2019-08-30"
"68.92","113.03","field_out","field_out","Jeren Kendall flies out to left fielder Spencer Griffin.  ","Jeren Kendall","Kyle Bradish",1,0,0,"fly_ball",0,0,0,0,1,0,"L","R",13,"576753.00",5,1,"N","2019-08-30"
"76.07","98.73","field_out","field_out","Deacon Liput flies out to left fielder Spencer Griffin.  ","Deacon Liput","Connor Higgins",2,0,0,"fly_ball",5,2,5,2,1,0,"L","L",13,"576753.00",67,8,"N","2019-08-30"
"149.95","168.63","field_out","field_out","Deacon Liput grounds out, first baseman Devin Davis to pitcher Nathan Bates.  ","Deacon Liput","Nathan Bates",0,2,1,"ground_ball",4,2,4,2,1,0,"L","R",13,"576753.00",50,6,"N","2019-08-30"
,,,"strikeout","Jeren Kendall called out on strikes.  ","Jeren Kendall","Kyle Bradish",0,1,2,,4,1,4,1,0,0,"L","R",13,"576753.00",43,5,"N","2019-08-30"
"132.47","168.63","force_out","force_out","Brayan Morales pops into a force out, pitcher Nathan Bates to shortstop Leonardo Rivas.   Starling Heredia out at 2nd.    Brayan Morales to 1st.  ","Brayan Morales","Nathan Bates",0,1,2,"popup",5,2,5,2,1,0,"R","R",13,"576753.00",59,7,"N","2019-08-30"
,,,"strikeout","Marcus Chiu called out on strikes.  ","Marcus Chiu","Kyle Bradish",0,0,2,,3,0,3,0,0,0,"R","R",13,"576753.00",17,2,"N","2019-08-30"
,,,"strikeout","Miguel Vargas strikes out swinging.  ","Miguel Vargas","Kyle Bradish",2,2,2,,4,2,4,2,0,0,"R","R",13,"576753.00",46,5,"N","2019-08-30"
,,,"strikeout","Miguel Vargas called out on strikes.  ","Miguel Vargas","Kyle Bradish",0,0,2,,4,1,4,1,0,0,"R","R",13,"576753.00",33,4,"N","2019-08-30"
,,,"strikeout","Marcus Chiu strikes out swinging.  ","Marcus Chiu","Nathan Bates",1,2,2,,4,2,4,2,0,0,"R","R",13,"576753.00",51,6,"N","2019-08-30"
,,,"strikeout","Dillon Paulson called out on strikes.  ","Dillon Paulson","Kyle Bradish",1,1,2,,4,1,4,1,0,0,"L","R",13,"576753.00",44,5,"N","2019-08-30"
,,,"strikeout","Jeren Kendall strikes out swinging.  ","Jeren Kendall","Nathan Bates",1,3,2,,5,2,5,2,0,0,"L","R",13,"576753.00",60,7,"N","2019-08-30"
"195.22","99.52","field_out","field_out","Devin Mann flies out to right fielder Orlando Martinez.  ","Devin Mann","Kyle Bradish",2,0,0,"fly_ball",0,0,0,0,1,0,"R","R",13,"576753.00",7,1,"N","2019-08-30"
"93.55","117.00","field_out","field_out","Marcus Chiu flies out to left fielder Spencer Griffin.  ","Marcus Chiu","Connor Higgins",0,0,0,"fly_ball",5,2,5,2,1,0,"R","L",13,"576753.00",73,9,"N","2019-08-30"
"116.58","157.51","field_error","field_error","Starling Heredia reaches on a fielding error by shortstop Leonardo Rivas.  ","Starling Heredia","Nathan Bates",0,2,2,"ground_ball",5,2,5,2,1,0,"R","R",13,"576753.00",58,7,"N","2019-08-30"
"159.48","171.81","field_out","field_out","Garrett Hope grounds out, first baseman Devin Davis to pitcher Nathan Bates.  ","Garrett Hope","Nathan Bates",2,1,1,"ground_ball",4,2,4,2,1,0,"R","R",13,"576753.00",52,6,"N","2019-08-30"
,,,"strikeout","Marcus Chiu strikes out swinging.  ","Marcus Chiu","Kyle Bradish",1,0,2,,4,1,4,1,0,0,"R","R",13,"576753.00",35,4,"N","2019-08-30"
,,,"walk","Devin Mann walks.  ","Devin Mann","Kyle Bradish",2,3,1,,4,1,4,2,0,0,"R","R",13,"576753.00",45,5,"N","2019-08-30"
,,,"strikeout","Brayan Morales called out on strikes.  ","Brayan Morales","Kyle Bradish",0,0,2,,0,0,0,0,0,0,"R","R",13,"576753.00",4,1,"N","2019-08-30"
,,,"walk","Brayan Morales walks.  ","Brayan Morales","Kyle Bradish",0,3,2,,3,0,3,0,0,0,"R","R",13,"576753.00",24,3,"N","2019-08-30"
,,,"walk","Deacon Liput walks.   Miguel Vargas to 2nd.  ","Deacon Liput","Kyle Bradish",0,3,1,,3,0,3,0,0,0,"L","R",13,"576753.00",16,2,"N","2019-08-30"
,,,"walk","Brayan Morales walks.  ","Brayan Morales","Kyle Bradish",0,3,2,,4,1,4,1,0,0,"R","R",13,"576753.00",42,5,"N","2019-08-30"
"50.65","87.61","double","double","Deacon Liput doubles (11) on a sharp line drive to left fielder Spencer Griffin.  ","Deacon Liput","Kyle Bradish",1,1,2,"line_drive",4,1,4,1,1,1,"L","R",13,"576753.00",34,4,"N","2019-08-30"
"145.18","154.33","force_out","force_out","Jeren Kendall grounds into a force out, second baseman Michael Stefanic to shortstop Leonardo Rivas.   Starling Heredia to 3rd.    Brayan Morales out at 2nd.    Jeren Kendall to 1st.  ","Jeren Kendall","Kyle Bradish",0,0,1,"ground_ball",3,0,3,0,1,0,"L","R",13,"576753.00",25,3,"N","2019-08-30"
,,,"strikeout","Miguel Vargas strikes out swinging.  ","Miguel Vargas","Connor Higgins",1,0,2,,5,2,5,2,0,0,"R","L",13,"576753.00",66,8,"N","2019-08-30"
,,,"strikeout","Dillon Paulson strikes out swinging.  ","Dillon Paulson","Nathan Bates",2,3,2,,5,2,5,2,0,0,"L","R",13,"576753.00",61,7,"N","2019-08-30"
,,,"strikeout","Garrett Hope strikes out swinging.  ","Garrett Hope","Connor Higgins",1,2,2,,5,2,5,2,0,0,"R","L",13,"576753.00",74,9,"N","2019-08-30"
,,,"walk","Starling Heredia walks.  ","Starling Heredia","Kyle Bradish",0,3,2,,3,0,3,0,0,0,"R","R",13,"576753.00",23,3,"N","2019-08-30"
"116.58","155.13","field_out","field_out","Devin Mann grounds out, shortstop Leonardo Rivas to first baseman Devin Davis.  ","Devin Mann","Connor Higgins",0,1,1,"ground_ball",5,2,5,2,1,0,"R","L",13,"576753.00",65,8,"N","2019-08-30"
"67.33","139.24","double","double","Starling Heredia doubles (15) on a soft line drive to left fielder Spencer Griffin.  ","Starling Heredia","Kyle Bradish",0,1,2,"line_drive",4,1,4,1,1,1,"R","R",13,"576753.00",41,5,"N","2019-08-30"
"100.69","169.43","field_out","field_out","Devin Mann grounds out, third baseman Zane Gurwitz to first baseman Devin Davis.  ","Devin Mann","Kyle Bradish",2,1,2,"ground_ball",3,1,3,1,1,0,"R","R",13,"576753.00",27,3,"N","2019-08-30"
,,,"walk","Miguel Vargas walks.  ","Miguel Vargas","Kyle Bradish",0,3,1,,3,0,3,0,0,0,"R","R",13,"576753.00",15,2,"N","2019-08-30"
"144.38","122.56","single","single","Jeren Kendall singles on a soft fly ball to center fielder Jeisson Rosario.   Garrett Hope scores.    Deacon Liput scores.    Brayan Morales to 3rd.  ","Jeren Kendall","Garrett Richards",2,1,2,"fly_ball",1,1,1,3,1,1,"L","R",13,"576752.00",20,2,"N","2019-08-29"
"139.62","113.82","single","single","Devin Mann singles on a line drive to center fielder Jeisson Rosario.   Brayan Morales scores.  Jeren Kendall out at 3rd on the throw, center fielder Jeisson Rosario to third baseman Gabriel Arias.  ","Devin Mann","Caleb Boushley",2,2,2,"line_drive",1,3,1,4,1,1,"R","R",13,"576752.00",21,2,"N","2019-08-29"
"85.60","94.76","sac_fly","sac_fly","Jacob Amaya out on a sacrifice fly to left fielder Jack Suwinski.   Miguel Vargas scores.  ","Jacob Amaya","Caleb Boushley",0,1,2,"fly_ball",3,4,3,5,1,0,"R","R",13,"576752.00",29,3,"N","2019-08-29"
"103.08","111.44","single","single","Garrett Hope singles on a fly ball to left fielder Jack Suwinski.  ","Garrett Hope","Caleb Boushley",0,1,2,"fly_ball",3,7,3,7,1,1,"R","R",13,"576752.00",52,6,"N","2019-08-29"
"126.91","197.23","field_out","field_out","Garrett Hope pops out to catcher Jalen Washington on the infield fly rule.  ","Garrett Hope","Caleb Boushley",1,0,0,"popup",3,5,3,5,1,0,"R","R",13,"576752.00",32,3,"N","2019-08-29"
,,,"hit_by_pitch","Marcus Chiu hit by pitch.    Jacob Amaya to 2nd.  ","Marcus Chiu","Garrett Richards",1,0,1,,1,0,1,0,0,0,"R","R",13,"576752.00",16,2,"N","2019-08-29"
"168.22","120.18","single","single","Marcus Chiu singles on a line drive to right fielder Tirso Ornelas.   Dillon Paulson to 2nd.  ","Marcus Chiu","Caleb Boushley",1,0,0,"line_drive",3,5,3,5,1,1,"R","R",13,"576752.00",31,3,"N","2019-08-29"
,,,"strikeout","Marcus Chiu strikes out swinging.  ","Marcus Chiu","Caleb Boushley",0,1,2,,3,7,3,7,0,0,"R","R",13,"576752.00",68,8,"N","2019-08-29"
,,,"strikeout","Marcus Chiu strikes out swinging.  ","Marcus Chiu","Caleb Boushley",2,1,2,,3,7,3,7,0,0,"R","R",13,"576752.00",47,5,"N","2019-08-29"
"169.01","120.97","single","single","Jacob Amaya singles on a line drive to right fielder Tirso Ornelas.  ","Jacob Amaya","Caleb Boushley",0,0,0,"line_drive",3,7,3,7,1,1,"R","R",13,"576752.00",66,8,"N","2019-08-29"
,,,"strikeout","Deacon Liput strikes out on a foul tip.  ","Deacon Liput","Caleb Boushley",0,2,2,,3,7,3,7,0,0,"L","R",13,"576752.00",53,6,"N","2019-08-29"
"122.14","101.91","field_out","field_out","Jeren Kendall flies out to center fielder Jeisson Rosario.  ","Jeren Kendall","Caleb Boushley",0,1,0,"fly_ball",3,7,3,7,1,0,"L","R",13,"576752.00",38,4,"N","2019-08-29"
"108.64","127.33","field_out","field_out","Dillon Paulson pops out to shortstop Xavier Edwards.  ","Dillon Paulson","Garrett Richards",0,2,1,"popup",1,0,1,0,1,0,"L","R",13,"576752.00",15,2,"N","2019-08-29"
,,,"strikeout","Jeren Kendall strikes out swinging.  ","Jeren Kendall","Garrett Richards",0,2,2,,1,0,1,0,0,0,"L","R",13,"576752.00",8,1,"N","2019-08-29"
"66.54","142.42","single","single","Dillon Paulson singles on a fly ball to left fielder Jack Suwinski.  ","Dillon Paulson","Caleb Boushley",1,3,2,"fly_ball",3,5,3,5,1,1,"L","R",13,"576752.00",30,3,"N","2019-08-29"
"111.82","171.02","grounded_into_double_play","grounded_into_double_play","Garrett Hope grounds into a double play, third baseman Gabriel Arias to second baseman Lee Solomon to first baseman Olivier Basabe.   Dillon Paulson out at 2nd.    Garrett Hope out at 1st.  ","Garrett Hope","Caleb Boushley",1,0,1,"ground_ball",3,7,3,7,1,0,"R","R",13,"576752.00",69,8,"N","2019-08-29"
"112.61","160.69","force_out","force_out","Garrett Hope grounds into a force out, shortstop Xavier Edwards to second baseman Lee Solomon.   Jacob Amaya to 3rd.    Marcus Chiu out at 2nd.    Garrett Hope to 1st.  ","Garrett Hope","Garrett Richards",1,1,1,"ground_ball",1,0,1,0,1,0,"R","R",13,"576752.00",17,2,"N","2019-08-29"
"103.08","70.93","double","double","Deacon Liput doubles (10) on a fly ball to center fielder Jeisson Rosario.   Dillon Paulson scores.    Marcus Chiu scores.  ","Deacon Liput","Caleb Boushley",2,1,0,"fly_ball",3,5,3,7,1,1,"L","R",13,"576752.00",33,3,"N","2019-08-29"
"151.53","161.48","field_out","field_out","Dillon Paulson grounds out, second baseman Lee Solomon to first baseman Olivier Basabe.  ","Dillon Paulson","Caleb Boushley",1,1,2,"ground_ball",3,7,3,7,1,0,"L","R",13,"576752.00",46,5,"N","2019-08-29"
"76.07","136.06","single","single","Dillon Paulson singles on a line drive to left fielder Jack Suwinski.   Jacob Amaya to 2nd.  ","Dillon Paulson","Caleb Boushley",0,2,2,"line_drive",3,7,3,7,1,1,"L","R",13,"576752.00",67,8,"N","2019-08-29"
,,,"walk","Brayan Morales walks.   Jacob Amaya scores.    Garrett Hope to 3rd.    Deacon Liput to 2nd.  ","Brayan Morales","Garrett Richards",2,3,2,,1,0,1,1,0,0,"R","R",13,"576752.00",19,2,"N","2019-08-29"
,,,"walk","Brayan Morales walks.  ","Brayan Morales","Garrett Richards",0,3,2,,1,0,1,0,0,0,"R","R",13,"576752.00",7,1,"N","2019-08-29"
,,,"walk","Jacob Amaya walks.  ","Jacob Amaya","Garrett Richards",0,3,2,,1,0,1,0,0,0,"R","R",13,"576752.00",14,2,"N","2019-08-29"
"164.24","144.80","field_out","field_out","Devin Mann pops out to second baseman Lee Solomon.  ","Devin Mann","Caleb Boushley",1,0,2,"popup",3,7,3,7,1,0,"R","R",13,"576752.00",39,4,"N","2019-08-29"
,,,"strikeout","Devin Mann strikes out swinging.  ","Devin Mann","Garrett Richards",1,2,2,,1,0,1,0,0,0,"R","R",13,"576752.00",9,1,"N","2019-08-29"
,,,"strikeout","Brayan Morales called out on strikes.  ","Brayan Morales","Caleb Boushley",1,2,2,,3,7,3,7,0,0,"R","R",13,"576752.00",54,6,"N","2019-08-29"
"109.43","171.81","field_out","field_out","Brayan Morales grounds out, third baseman Gabriel Arias to first baseman Olivier Basabe.  ","Brayan Morales","Caleb Boushley",2,1,0,"ground_ball",3,7,3,7,1,0,"R","R",13,"576752.00",34,3,"N","2019-08-29"
,,,"walk","Deacon Liput walks.   Garrett Hope to 2nd.  ","Deacon Liput","Garrett Richards",2,3,1,,1,0,1,0,0,0,"L","R",13,"576752.00",18,2,"N","2019-08-29"
"97.52","171.81","field_out","field_out","Miguel Vargas grounds out sharply, third baseman Gabriel Arias to first baseman Olivier Basabe.  ","Miguel Vargas","Garrett Richards",2,3,2,"ground_ball",1,0,1,0,1,0,"R","R",13,"576752.00",10,1,"N","2019-08-29"
"111.02","155.13","grounded_into_double_play","grounded_into_double_play","Miguel Vargas grounds into a double play, shortstop Xavier Edwards to second baseman Lee Solomon to first baseman Olivier Basabe.   Devin Mann out at 2nd.    Miguel Vargas out at 1st.  ","Miguel Vargas","Caleb Boushley",1,2,2,"ground_ball",3,7,3,7,1,0,"R","R",13,"576752.00",62,7,"N","2019-08-29"
"114.99","160.69","field_out","field_out","Miguel Vargas grounds out, shortstop Xavier Edwards to first baseman Olivier Basabe.  ","Miguel Vargas","Caleb Boushley",2,0,0,"ground_ball",3,7,3,7,1,0,"R","R",13,"576752.00",40,4,"N","2019-08-29"
"131.67","117.79","single","single","Miguel Vargas singles on a sharp ground ball to center fielder Jeisson Rosario.  ","Miguel Vargas","Caleb Boushley",0,3,2,"ground_ball",3,4,3,4,1,1,"R","R",13,"576752.00",28,3,"N","2019-08-29"
"103.87","89.99","field_out","field_out","Jacob Amaya flies out to left fielder Jack Suwinski.  ","Jacob Amaya","Caleb Boushley",0,0,0,"fly_ball",3,7,3,7,1,0,"R","R",13,"576752.00",45,5,"N","2019-08-29"
"124.53","117.00","single","single","Devin Mann singles on a ground ball to center fielder Jeisson Rosario.  ","Devin Mann","Caleb Boushley",1,0,0,"ground_ball",3,7,3,7,1,1,"R","R",13,"576752.00",61,7,"N","2019-08-29"
"118.17","166.25","field_out","field_out","Jeren Kendall grounds out, shortstop Xavier Edwards to first baseman Olivier Basabe.  ","Jeren Kendall","Caleb Boushley",0,0,0,"ground_ball",3,7,3,7,1,0,"L","R",13,"576752.00",60,7,"N","2019-08-29"
,,,"walk","Deacon Liput walks.  ","Deacon Liput","Angel Acevedo",0,3,2,,2,4,2,4,0,0,"L","R",13,"576751.00",51,6,"N","2019-08-28"
"158.68","117.00","double","double","Jeren Kendall doubles (11) on a fly ball to center fielder Jeisson Rosario.   Dillon Paulson scores.    Starling Heredia scores.    Brayan Morales scores.  ","Jeren Kendall","Osvaldo Hernandez",2,1,1,"fly_ball",0,1,0,4,1,1,"L","L",13,"576751.00",18,2,"N","2019-08-28"
"92.75","45.51","triple","triple","Jeren Kendall triples (10) on a fly ball to left fielder Olivier Basabe.  ","Jeren Kendall","Angel Acevedo",1,1,0,"fly_ball",2,4,2,4,1,1,"L","R",13,"576751.00",58,7,"N","2019-08-28"
"146.77","160.69","field_out","field_out","Tre Todd grounds out, second baseman Xavier Edwards to first baseman Olivier Basabe.  ","Tre Todd","Angel Acevedo",2,1,0,"ground_ball",2,4,2,4,1,0,"L","R",13,"576751.00",53,6,"N","2019-08-28"
"153.92","168.63","field_out","field_out","Jeren Kendall lines out sharply to first baseman Olivier Basabe.  ","Jeren Kendall","Angel Acevedo",0,1,2,"line_drive",2,4,2,4,1,0,"L","R",13,"576751.00",41,5,"N","2019-08-28"
"162.66","149.57","single","single","Jeren Kendall singles on a soft line drive to right fielder Tirso Ornelas.  ","Jeren Kendall","Osvaldo Hernandez",1,1,0,"line_drive",0,0,0,0,1,1,"L","L",13,"576751.00",5,1,"N","2019-08-28"
"39.53","117.00","double","double","Devin Mann doubles (19) on a sharp line drive to left fielder Allen Cordoba.  ","Devin Mann","Angel Acevedo",2,0,2,"line_drive",2,4,2,4,1,1,"R","R",13,"576751.00",43,5,"N","2019-08-28"
,,,"strikeout","Tre Todd called out on strikes.  ","Tre Todd","Osvaldo Hernandez",1,3,2,,0,0,0,0,0,0,"L","L",13,"576751.00",16,2,"N","2019-08-28"
"154.71","168.63","field_out","field_out","Tre Todd grounds out to first baseman Olivier Basabe.  ","Tre Todd","Angel Acevedo",1,0,0,"ground_ball",2,4,2,4,1,0,"L","R",13,"576751.00",36,4,"N","2019-08-28"
"40.32","66.16","home_run","home_run","Devin Mann homers (19) on a fly ball to left field.   Miguel Vargas scores.  ","Devin Mann","Angel Acevedo",1,0,1,"fly_ball",2,5,2,7,1,1,"R","R",13,"576751.00",60,7,"N","2019-08-28"
"137.24","97.93","field_out","field_out","Jacob Amaya flies out to center fielder Jeisson Rosario.  ","Jacob Amaya","Osvaldo Hernandez",1,3,2,"fly_ball",2,4,2,4,1,0,"R","L",13,"576751.00",27,3,"N","2019-08-28"
"120.55","114.62","single","single","Jacob Amaya singles on a sharp ground ball to center fielder Jeisson Rosario.  ","Jacob Amaya","Osvaldo Hernandez",0,0,0,"ground_ball",0,0,0,0,1,1,"R","L",13,"576751.00",12,2,"N","2019-08-28"
"146.77","159.10","field_out","field_out","Deacon Liput grounds out sharply, second baseman Xavier Edwards to first baseman Lee Solomon.  ","Deacon Liput","Angel Acevedo",2,1,0,"ground_ball",2,7,2,7,1,0,"L","R",13,"576751.00",63,7,"N","2019-08-28"
"149.15","156.72","field_out","field_out","Deacon Liput grounds out, second baseman Xavier Edwards to first baseman Olivier Basabe.  ","Deacon Liput","Angel Acevedo",2,0,1,"ground_ball",2,4,2,4,1,0,"L","R",13,"576751.00",29,3,"N","2019-08-28"
,,,"strikeout","Miguel Vargas strikes out swinging.  ","Miguel Vargas","Angel Acevedo",1,1,2,,2,4,2,4,0,0,"R","R",13,"576751.00",42,5,"N","2019-08-28"
